id,text,aspect,category,polarity,from,to
625,2nd flight also delayed no pilots! But they boarded is so we can just sit here! scheduling,delays,scheduling,negative,-1,-1
626,unfortunately still on the Tarmac at and definitely missing my ride from GonnaBeALongNight,Tarmac,flight,neutral,27,33
627,"As one of the travelers affected by the Boston storm, I'm shocked at Virgin's complete apathy toward their customers.",apathy,service,negative,87,93
628,I like the TV and interesting video . Just disappointed in Cancelled Flightled flight when other flights went out to jfk on Saturday .,Late Flight,flight,negative,-1,-1
629,always!!! Xoxo,implicit,implicit,positive,-1,-1
630,"rebooting Chicago dispatch system, need as I'm tired of sitting on planes",dispatch system,service,neutral,18,33
631,"I did start a claim but 8-10 weeks is unrealistic, am I really supposed to go that long with out a car seat for my child.Ridiculous!",car seat,baggage,negative,99,107
632,"ok. To top things off, you've lost my luggage. Could you get ANY worse??? UnitedAirlines",luggage,airline,negative,38,45
633,My mom left her Kindle on flight 1544 today. Burgundy case with a light. Seat 27D. Did anyone find it?,Kindle,baggage,neutral,16,22
634,thanks! Will you guys be getting the A380s anytime soon?,A380s,airline,neutral,37,42
635,"done. Want me to send a screen shot of the second call, which is now at over 45 minutes?",call,service,negative,50,54
636,Big thanks to Ms. Winston for assisting me over the phone with a baggage claim issue today. She really went the extra mile!,baggage,service,positive,65,72
637,Adds Pillows Instead of Lie-Flat Seats in First Class Arms Race by,seats,flight,neutral,33,38
638,announced New Route to Austin w/fares from $39/way.,fares,pricing,neutral,32,37
639,But they are not... lady one phone says its in tel aviv. Tel Aviv united says its in Newark. No one knows and I have nothing...,luggage,baggage,negative,-1,-1
640,Need more info on that! : We have great amenity kits. PJ's not included. We status match AA. ^KP”,price,service,neutral,-1,-1
641,check the website before you go to the airport!,website,service,neutral,10,17
642,GRK13575M is the file reference,file reference,service,negative,17,31
643,Decisions Decisions : We'd love for you to try our service. We offer status match too. ^KP”,amenity kits,service,neutral,-1,-1
644,you are one great airline ❤️,airline,service,positive,18,25
645,Not a happy flyer. UA flight 1161 from SFO to Cleveland. Sunday 2/22. Stay tuned for blog article from,baggage,service,negative,-1,-1
646,private jet would have been cool! Do does not work. I'll try again,flights,flight,positive,-1,-1
647,It's a shame choosing United may be the difference between reuniting with aging friends and never seeing them again PoorService,service,service,negative,120,127
648,"yes, they said it took more than an hour!",flight,service,negative,-1,-1
649,help. I was On Flight 27 from JKF tonight. seat 7C left portfolio. Need it back!!,portfolio,baggage,neutral,56,65
650,thank you! See y'all soon! I'm excited to see the expansion of destinations. Spread those wings!,destinations,service,positive,63,75
651,it was a disappointing experience which will be shared with every business traveler I meet. neverflyvirgin,experience,service,negative,23,33
652,We've been waiting on tarmac for &gt;1hr because apparently UA1116 is overweight and we returned to gate. WTF fb,tarmac,flight,negative,22,28
653,had me at their safety video . . . LOVED my first cross country flight. livewelltraveled sytycd,CEO,airline,positive,-1,-1
654,they helped me at the baggage service desk. Said bc TSA screening was down in FLL not all bags made it but bag will be in EWR @ 12,baggage service desk,baggage,negative,22,42
655,"well, you can't fix me missing my buddies 30th bday because of negligence but you can attempt to make up for it.",negligence,service,negative,63,73
656,👍👍✈️✈️💗 When are you guys going to start flying to Paris? : You're welcome.”,flying,airline,neutral,41,47
657,": I don't care that a link showed me a ""wrong"" price on your site—it's your site and responsibility to ensure correctness.",seating,seats,negative,-1,-1
658,YES FYI MY BFF,implicit,implicit,neutral,-1,-1
659,That's classy.,flights,service,positive,-1,-1
660,"Thanks so much for the awesome support, you guys rock!",support,service,positive,31,38
661,"Wow. What a deal. Again, 30+ plus seats available. Easy change to make a customer happy.",email,service,positive,-1,-1
662,you guys need some serious training in customer service. Too many better options to put up with the way you guys handle ur mistakes,customer service,staff,negative,39,55
663,This is NOT a local UNITED number for Malaysia 0011 800-55558000. What is your local United Airlines here in Kuala Lumpur ( KUL )?,phone number,contact,neutral,-1,-1
664,why are your first fares in May over three times more than other carriers when all seats are available to select???,fares,pricing,negative,19,24
665,"During the same round trip, my NON-English speaking friend was stranded TWICE for 12+ hours each time! Most staff members were rude.",United agent,staff,negative,-1,-1
666,"Nice, Lofty View . SilverStatus",Status Match,service,neutral,-1,-1
667,I emailed your customer service team. Let me know if you need the tracking number.,customer service,service,neutral,15,31
668,So excited for my first cross country flight LAX to MCO I've heard nothing but great things about Virgin America. 29DaysToGo,seat,comfort,positive,-1,-1
669,"beats expectations, shares take off - Santa Cruz Sentinel",implicit,implicit,neutral,-1,-1
670,you ROCK for making it so I can watch Oscars on my flight!! redcarpet oscars oscars2015,flight,service,positive,51,57
671,Could this email be resent as it doesnt appear to have arrived.,flight,airline,negative,-1,-1
672,you are easily the worst company I have ever experienced. You have lost someone's personal possessions and you couldn't care less!....,personal possessions,baggage,negative,82,102
673,please provide status for flight 769. I cant imagine it's on time as the Web indicates dude to weather here and/or Dallas,flight,flight,negative,26,32
674,"- the passenger in 7D, Flt 338 that assaulted me shouldn't have flown. I trust he's banned. Crew filed report to",crew,staff,negative,92,96
675,"yes, a paper voucher that I got on January 26th 2015",voucher,service,neutral,13,20
676,Today was not your finest. All could have been prevented by one gate agent advising 200 passengers.,gate agent,staff,negative,64,74
677,currently on board so not now. Check in was terrible. Staff rude. Expensive luggage thrown around etc.,check in,service,negative,31,39
678,"nice your app says US 4972 delayed by weather. Pilot says waiting on fuel. One in ur control, one not",app,technology,negative,10,13
679,"On a standby to Denver, which has been delayed, and a confirmed to Aspen, whose flights have been Cancelled Flighted all day. 0 confidence.",flight,service,negative,80,86
680,"our flight into lga was Cancelled Flighted. We're stuck in Dallas. I called to reschedule, told I could get a flight for today...(1/2)",flight,cancellation,negative,4,10
681,So you are inadequate by accident?,inadequate,service,negative,11,21
682,"Trying to reset my password, email never arrives. Help?",password,service,negative,19,27
683,OKC ticket agent Roger McLarren(sp?) LESS than helpful with our Intl group travel problems Can't find a supervisor for help.,ticket agent,staff,negative,4,16
684,despite my bag not making it to Newark good informative email tracking updates help!,customer service,service,positive,-1,-1
685,that's right- with an overnight Miami.,layover,flight,neutral,-1,-1
686,is the worst airline in the world.,service,service,negative,-1,-1
687,you got cheese pLate Flights too.,Flights,service,neutral,21,28
688,"yes in Lusaka, Zambia. My guess is the bags never made the plane at IAD.",bags,baggage,negative,39,43
689,Lister to my show my on Monday 1230 130,application,service,neutral,-1,-1
690,completed form but doubt it's any use. UA doesn't care. 6 day vacation will now be 5. Sure UA won't feel responsibility for that...,vacation,experience,negative,62,70
691,"441, which also had 1 working WC in coach. Good thing this bird landed ahead of schedule. I have to use the WC stat.",WC,facilities,positive,30,32
692,I flew United last month and the experience was AWESOME!,connection,service,positive,-1,-1
693,yes at 2am...but now back on a plane again and delayed again due to baggage loading issue...,baggage,service,negative,68,75
694,A Tourist Wonder: Super Tides and Tide of the Century at French and U.K coasts:,implicit,airline,neutral,-1,-1
695,did you know that suicide is the second leading cause of death among teens 10-24,death,implicit,neutral,57,62
696,"found a group of people who actually hates people more than ISIS, thats right United Airlines.",frustration,experience,negative,-1,-1
697,your website sucks donkey dicks. Just thought you should know. All best.,passbook,service,negative,-1,-1
698,Luckily I made my flights this time but was so disappointed with the lack of communication :(,communication,airline,negative,77,90
699,I requested a mileage challenge for status several weeks ago online but haven't heard back. How do I get help with this?,mileage challenge,service,negative,14,31
700,Thank you for responding so quickly with a helpful tool!,tool,service,positive,51,55
701,"Nice RT : The man of steel might be faster, but we have WiFi – just saying. ScienceBehindTheExperience",WiFi,service,positive,56,60
702,"Done, but I need the receipt ASAP. Could you please help? 150219-000114",receipt,service,neutral,21,28
703,"the proper response: sorry for your wait, what flight were you on so we can look into the issue. That's how would handle.",response,service,negative,11,19
704,just wanted to let you know how wonderful Rosetta the gate agent was working flight 6457 Dan to Ase. Let her know she wasappreciated,gate agent,staff,positive,54,64
705,"i understand, thanks",implicit,implicit,neutral,-1,-1
706,Please than Robin at EWR Premiere Desk for helping me get on a an earlier flight. She did the work. Huge thanks.,flight,service,positive,74,80
707,your customer service is terrible! Stood inline 3 hours no flights and 4 hours Late Flightr still no bagdisgutedindenver,customer service,service,negative,5,21
708,trying to book a flight and your site is down 😁,airline,airline,negative,-1,-1
709,I was so looking forward to my first flight with you today but it was Cancelled Flightled along with the subsequent one ...,flight,service,negative,37,43
710,My bag is still in Colo Springs. I am disabled and have to search an unfamiliar airport and look for my bag. Not a good outcome,bag,baggage,negative,3,6
711,"another perfect flight. How come on your planes, the sun visors can stay down? Other carriers make you raise them?",sun visors,seats,positive,53,63
712,THANK U! Secured room for the night Thx to VERY helpful customer service rep N. Dorns.. I thanked her.. Can u 2? goodenoughmother,customer service,service,positive,56,72
713,"it's really aggressive to blast obnoxious ""entertainment"" in your guests' faces and they have little recourse",entertainment,service,negative,43,56
714,but it's hard to stay upset at someone when they at least TRY to show remorse.,neglect,customer service,negative,-1,-1
715,you are failing your customers because your check in process does not link to TSA pre-check.,check in process,service,negative,44,60
716,mobile apps need construction from the ground up for each OS category. It's expensive to get right .,mobile apps,technology,negative,0,11
717,"has getaway deals through May, from $59 one-way. Lots of cool cities CheapFlights FareCompare",deals,service,neutral,12,17
718,weather delays &gt; next few weeks ;) JFK BOS DCA,delays,weather,neutral,8,14
719,Random Q: what's the distribution of elevate avatars? I bet that kitty has a disproportionate share,elevate avatars,app,neutral,37,52
720,. I heard he has a virgin mobile hotspot ;),hotspot,service,neutral,33,40
721,Are there any plans for a short haul airline in Europe? Would defiantly fly with you guys :),short haul airline,service,positive,26,44
722,THAT'S your response? Shaking my head back and forth with a tsk. You can do better-from customer service to your apology,customer service,service,negative,88,104
723,No. Denver said they don't handle baggage that made it to Colo. Springs. They gave me an 800 number to call. No help there either.,baggage,baggage,negative,34,41
724,is your website ever coming back online?,website,app,neutral,8,15
725,"""You down with RNP?"" ""Yeah you know me!""",points,service,neutral,-1,-1
726,"I am trying to find out if the loaner seat is new or used, a used car seat is illegal according to safety regulations",details,service,neutral,-1,-1
727,"Hi, Virgin! I'm on hold for 40-50 minutes -- are there any earlier flights from LA to NYC tonight; earlier than 11:50pm?",flights,service,negative,67,74
728,someone needs to DM me and resolve this correctly. Extremely disappointed with the service I received. Terrible management.,service,service,negative,83,90
729,"Kewl. Will also let them know the overhead bin over my row was ""Inop"". I love a good abbreve.",seats,service,neutral,-1,-1
730,All were entertaining,implicit,implicit,neutral,-1,-1
731,"If you'd love to see more girls be inspired to become pilots, RT our free WOAW event March 2-8 at ABQ.",pilots,staff,neutral,54,60
732,"I guess that's too much ask, huh?",apology,customer service,neutral,-1,-1
733,"fucked up, then voided my ticket, and KEPT MY MONEY. Not even an apology. I will never fly with your airline again. UnitedAirlines",ticket,service,negative,26,32
734,please contact me about portfolio left on flight VX 27 from JFK to SFO tonite seat 7AM. Need it returned. Call 914-329-0185.,portfolio,baggage,neutral,24,33
735,Flight 0736 DAL to DCA 2/24 2:10pm. Tried to check in could not. Status please.,check in,service,neutral,45,53
736,"yes please! I am newly married and trying to update my last name on a preexisting international flight! It seems so easy, but...",last name,service,negative,55,64
737,like continental's chicken feat fairs,chicken,meal,neutral,19,26
738,The bright side would be keeping the promise that was made to me. Hope you're having a good night. Thanks.,promise,service,negative,37,44
739,Is it normal to receive no reply from Central Baggage baggageissues smh,baggage,service,negative,46,53
740,I think i left something on the plane yesterday. who do i call...ah!,plane,lost items,neutral,32,37
741,Fingers crossed and its all intact. Very disappointed with this experience as before this we were actually saying we enjoyed using you,system,technology,negative,-1,-1
742,if I pay you $25 and $35 for my luggage to be delivered when I arrive. Why should I have to wait 3 additional days for its delivery?,luggage delivery,baggage,negative,-1,-1
743,has the most INCREDIBLE customer service I've ever experienced! So refreshing!,customer service,service,positive,24,40
744,"Not appropriate to ask in public (hence the dm). each united employee, each a new answer. your process was such a hassle i Cancelled Flighted.",process,service,negative,95,102
745,I can't check in or add a bag. Your website isn't working. I've tried both desktop and mobile,bag,baggage,negative,26,29
746,"announces new nonstop connecting and , $39 intro:",route,service,neutral,-1,-1
747,now what?!? flight was gone when I got off plane! BusinessTravel goodenoughmother,flight,service,negative,12,18
748,Does customer care have email or a phone rep that I can speak with? We had so many issues they can't be placed in 2000 characters?,customer care,customer service,negative,5,18
749,"Gate agent hooked me up with alternate flights. If you have a way to PREVENT the constant issues, that would rock.",departure,travel,negative,-1,-1
750,what's a girl gotta do to get a flight name change when SHE bought one for a mean ex boyfriend and needs a girl's trip stat?!,flight,flight,neutral,32,38
751,Many Thanks for the Follow. ourprincess freyasfund USA Bandie Looking for Any Help😍 💗🇬🇧💗🇺🇸💗 🎀🌏🎀,implicit,general,neutral,-1,-1
752,- Let 2 scanned in passengers leave the plane than told someone to remove their bag from 1st class bin? uncomfortable,passengers,staff,negative,19,29
753,are you ready!? Let's say it together.. 'Noooo turbulence today!' 😘,service,service,neutral,-1,-1
754,That's real dedication and concern. Your apologies don't fix the issue nor any of the miserable issues I've had over the past 6 mos.,issues,service,negative,96,102
755,I'm trying to check into my 10:50AM CT flight tmm on the desktop website and it's not working (some sort of caching bug) SOS,flight,check-in,negative,39,45
756,"I'm saying I made the flight but with poor/non-communication, unaccounted for lost time and lots of frustrated flyers standing around",communication,service,negative,47,60
757,wont transfer flight ticket to accompany an 11 yr old who's active military mom had to have emergency brain surgery? WOW!!,flight ticket,ticketing,negative,14,27
758,“: Book out of town with fares from $59/way (+restr).,fares,pricing,neutral,25,30
759,"I will do delayed baggage claim when I land. Hopefully the bag isn't broken into, damaged or lost w/c will result in more complaints",baggage,service,negative,18,25
760,I have lots of flights to book and your site it not working!!!! I've been on the phone waiting for over 10 minutes..........,site,service,negative,40,44
761,having problems Flight Booking Problems on the web site. keeps giving me an error and to contact by phone. phone is 30 minute wait.,website,app,negative,-1,-1
762,Need to change reservation. Have Virgin credit card. Do I need to modify on phone to waive change fee? Or can I do online?,reservation,service,neutral,15,26
763,"Just got demoted from Gold cuz my hubby got 100% of the PQD, tho there were enuf $ spent for 4 Golds.spousal.discrimination/angry.",status,service,negative,-1,-1
764,iCloud it is not there yet -- PLEASE HELP 917 703 1472,baggage claim,service,negative,-1,-1
765,Your website is down and I'm trying to check in!,website,service,negative,5,12
766,that totally sucks my cousin worked at PHL said,PHL,airport,negative,39,42
767,why no preferred security line anymore. My TSA pre-check didn't pull on my partner flight! Platinum spoiled,security line,service,negative,17,30
768,you're the best!! Whenever I (begrudgingly) use any other airline I'm delayed and Late Flight :(,delays,flight,negative,-1,-1
769,DM sent,delays,flight,neutral,-1,-1
770,way to take advantage of MayweatherPacquiao :),implicit,implicit,neutral,-1,-1
771,flight delayed-no one remembered to turn the heat on flight 559 leaving ORD-seriously???,refund claim,airline,negative,-1,-1
772,Status match - 2 weeks have gone by and no news.Flt next week - hope flt will count towards requirement. Cust Svc no help!!!,channels,service,negative,-1,-1
773,what is that going to do for you? Nothing just like you always do,service,service,negative,-1,-1
774,you are the worst. I will avoid you like the plague.,airline,service,negative,-1,-1
775,"I need the phone number to baggage claim in LAX, my mom left her phone and someone called saying they would put it there but on",customer service,service,neutral,-1,-1
776,"bet you wont honour them, like mine ey",honour,policy,neutral,13,19
777,"yes, David Allan send an email with this number (KMM24999563V99860L0KM) and case8719519",email,service,neutral,25,30
778,or has lost my baggage… heard different things from different employees of . has said nothing.,ticket change fees,fees,negative,-1,-1
779,"I just did, how can I DM? Do u have to also add me?",DM,service,neutral,22,24
780,first time flying with United. Also last time. terrible back to for me. branson virginatlantic UnitedAirlines,communication,service,negative,-1,-1
781,to jump into the Dallas Austin market,market,service,neutral,31,37
782,load balancing system apparently down systemwide - major impact on all united airlines flights. Was this a cyberattack?,load balancing system,service,negative,0,21
783,I sent the message. Let me know ASAP.,message,service,neutral,11,18
784,can you tell me how to file a claim for clothing that had to be purchased?,claim for clothing,service,negative,30,48
785,thank you! I absolutely will 😎,check in,service,positive,-1,-1
786,Use another browser! 2015 and a brand with a reputation built on tech response doesn't have a cross-browser compatible website?,website,service,negative,119,126
787,I did. The AC went on for about 20 minutes before returning to the Mojave Desert. PressureCooker HeatTrap,AC,service,negative,11,13
788,Definitely a compliment! I really thought my bag was lost after it was sent on to another airport. In the end I am a happy customer,bag,baggage,positive,45,48
789,that's unfortunate. The was an xmas gift and it looks like a razor ripped right through the front pocket in the picture,upgrades,service,negative,-1,-1
790,completely awesome experience last month BOS-LAS nonstop. Thanks for such an awesome flight and depart time. VAbeatsJblue,experience,service,positive,19,29
791,"better train your support staff with appropriate decorum, consider revisiting your terrible ""provide a death certificate' policy",apology,service,negative,-1,-1
792,you guys continue to impress me in Houston.,phones calls,service,positive,-1,-1
793,once united's service levels reaches those of Etihad or lets be more realistically Lufthansa then ill consider it again,service levels,service,negative,14,28
794,On all your flights?,flights,service,neutral,12,19
795,I need a receipt for a flight change. Can you send one?,status match request,loyalty,neutral,-1,-1
796,.. Can you help? Left my blazer in. Kooples jacket bag at 3rd row second seat from right gate 36 T3 lax.. Flight to sfo,blazer,baggage,neutral,25,31
797,I would like to know what's going on before his current flight lands.,flight,flight,neutral,56,62
798,DREAM,implicit,implicit,neutral,-1,-1
799,of course! I work for and I'm obsessed with the entire Virgin family!!,Virgin family,airline,positive,55,68
800,was no one between the scan and inside the plane. I just asked the people in line around me where the plane was going,plane,service,negative,43,48
801,your site is tripping. I'm trying to check in and I'm getting the plain text version. I am reluctant to enter any card info.,site,app,negative,5,9
802,"Sorry, Mary Martin had it first!",Mary Martin,entertainment,neutral,7,18
803,system failure again = bad trend. Software projects are like flying an airplane; there's no such thing as an emergency takeoff.,system failure,service,negative,0,14
804,flight attendant doesn’t understand not understanding English doesn’t mean they are deaf. Stop yelling English slowly to them.,flight attendant,staff,negative,0,16
805,common!! keep your paper work ready and don't delay our flights(1585)and meetings,connection,flight,negative,-1,-1
806,yes I filed a claim and hope to receive by luggage by 2am. Ridiculous as I had to purchase items to go to sleep and no reimbursement.,luggage,baggage,negative,43,50
807,please add more frequency to PDX Portland,frequency,service,neutral,16,25
808,I flew from NYC to SFO last week and couldn't fully sit in my seat due to two large gentleman on either side of me. HELP!,flying,travel,negative,-1,-1
809,A refund and flight vouchers or another flight on a different airline at your expense for today. 8 hour drive is very inconvenient,customer care,service,negative,-1,-1
810,Adds Pillows Instead of Lie-Flat Seats in First Class Arms Race,seats,airline,neutral,33,38
811,- Why can't I get a boarding pass for my Austrian Airlines codeshare flight. Rebook incls a 6 hour layover and I am stuck outside sec,boarding pass,service,negative,20,33
812,is there special assistance if I travel alone w/2 kids and 1 infant? Priority boarding?,assistance,service,neutral,17,27
813,partners with Checkout as mobile payment method to help boost mobile conversion rates etailwest payments visa,product,service,neutral,-1,-1
814,I called a 3-4 weeks ago about adding 3 flights from 2014 to my Elevate...they still haven't shown up...help!,flights,service,negative,40,47
815,I &lt;3 pretty graphics. so much better than minimal iconography. :D,graphics,design,positive,15,23
816,"- Is Flight 713 from Love Field to SFO definitely Cancelled Flightled for Monday, February 23?",flight,flight,neutral,5,11
817,Premier Gold desk changes flight. Waives fees. Gives me wrong flight. Now Jana Acosta in Salt Lake refuses the same service. Angry.,flight,service,negative,26,32
818,Deep Vein thrombosis,connections,service,neutral,-1,-1
819,Agent in LAS letting 20 customers know they can't help them rebook delayed flight to DEN unfriendlyskies,agent,staff,negative,0,5
820,Julie Andrews. Hands down.,deal,service,neutral,-1,-1
821,Connection at ORD was on the exact same plane again. Checked carry-on was apparently taken off and left in Chicago. Pretty ridiculous.,claim,service,negative,-1,-1
822,do you miss me? Don't worry we'll be together very soon.,cold air,comfort,neutral,-1,-1
823,is doing musicians real dirty at LAX. I've never been blocked from getting on a flight with my bass.,seats,service,negative,-1,-1
824,“: Of course. Have fun celebrating!” Thanks! Happy Chinese New Year!,implicit,implicit,positive,-1,-1
825,what is your policy on flying after surgery?,policy,health,neutral,13,19
826,Are the hours of operation for the Club at SFO that are posted online current?,headphones,lost items,neutral,-1,-1
827,UA63 from Madrid arrived no agent mass confusion we sent to and fro by 3 UA employees. MaryJo was rude and unhelpful.,mass confusion,staff,negative,34,48
828,I will not be flying you again,Flight,flight,negative,-1,-1
