id,text,aspect,category,polarity,from,to
214,"Hey, first time flyer next week - excited! But I'm having a hard time getting my flights added to my Elevate account. Help?",flights,service,negative,81,88
215,Applied for Status Match on Feb 1. Got confirmation email same day. Still no news though. You guys have dropped ball Late Flightly 😥,airline,general,negative,-1,-1
216,"Now, when will we see VirginAmerica come to Philadelphia (PHL).",route,service,neutral,-1,-1
217,beginning of Feb I called United they said they would send another voucher by mail. Never got anything. tiredofwaiting,voucher,service,negative,67,74
218,"I send you an urgent message via eservice.com. BG0KWM Narayanan. Please respond ASAP. Also, NO local United Tel @ KUL",service,service,neutral,34,41
219,Your ERI-ORD express connections are hugely popular .. now if only we could have an ERI-EWR hop! :),flight,travel,negative,-1,-1
220,"Well, I didn't…but NOW I DO! :-D",trip,travel,positive,-1,-1
221,Just bought tix for ATX - Dallas route - thanks for adding that! Love yr airline and yr website is BEST transactional site EVER,tix,flight,positive,12,15
222,"Is flight 769 on it's way? Was supposed to take off 30 minutes ago. Website still shows ""On Time"" not ""In Flight"". Thanks.",flight,service,neutral,3,9
223,I was scheduled for SFO 2 DAL flight 714 today. Changed to 24th due weather. Looks like flight still on?,flight,flight,neutral,30,36
224,How do I reschedule my Cancelled Flightled flights online? The change button is greyed out!,flight,flight,negative,33,39
225,you guys messed up my seating.. I reserved seating with my friends and you guys gave my seat away ... 😡 I want free internet,seating,service,negative,22,29
226,I'm disappointed that the agent at the designated silver status check in line closed to assist all pasengers,agent,staff,negative,26,31
227,This is such a great deal! Already thinking about my 2nd trip to and I haven't even gone on my 1st trip yet! ;p,deal,pricing,positive,21,25
228,twitter team. you guys killed it for rescheduling me asap. thank you!,team,staff,positive,8,12
229,. If only you guys were starting those flights at the end of the month! Guess I’m still road tripping on Feb 27…,flights,service,neutral,39,46
230,"- can you tweet me the Cancelled Flight/chng fee for a flight? or can I rebook under one of your affiliates? If so, who are afiliates?",Cancelled Flight/chng fee,service,neutral,23,48
231,"Thanks; might want to fix this line: ""Our Customer Care team is currently responding to most inquiries within 7-10 business days.""",Customer Care,service,negative,42,55
232,This isn't a one time thing either! It's a shocking pattern of repeated neglect and disrespect.,fix,service,negative,-1,-1
233,got it squared away. Someone picked up as soon as I tweeted. Should have tweeted sooner. 😉,service,service,positive,-1,-1
234,Really? Sprint? I thought you guys were 'kewl'! 0_0,planes,service,neutral,-1,-1
235,seriously would pay $30 a flight for seats that didn't have this playing. it's really the only bad thing about flying VA,seats,comfort,negative,37,42
236,okay ase24766m. Find our luggage.,luggage,baggage,negative,25,32
237,blocked me from DM'ing them because they would rather I complain about them in a public forum,forum,service,negative,88,93
238,"My post was just more of disappointment. I'm a frequent United flyer, it was a simple ??. 1 bad apple doesn't spoil the bunch.",Houston,location,neutral,-1,-1
239,yea get me to phoenix already. Delays all day with you people. It's bullshit.,staff,staff,negative,-1,-1
240,“:You've met your match.Got status on another airline? Upgrade : ? 🙉,airline,airline,neutral,46,53
241,is helping me step up my game! TinderTips tinderchamp,product,implicit,neutral,-1,-1
242,"- amazing customer service, again! 💕💕 RaeAnn in SF - she's the best! customerservice virginamerica flying",customer service,service,positive,10,26
243,. They were very understanding and helped me out. Thx! Comps,understanding,service,positive,17,30
244,I love this graphic.,graphic,branding,positive,12,19
245,A measly $50 e-certificate is not how you appreciate loyal customers after they wait 3hrs on the tarmac during UA1116. unacceptable,e-certificate,service,negative,13,26
246,Why is it taking 12 years to fly home to Dallas? Get your shit together.,flight,service,negative,-1,-1
247,the person is currently bettween gates 71A and 73 in LAX,response,service,neutral,-1,-1
248,you know I'm flying virgin for the fight MayweatherPacquiao,flight,airline,neutral,-1,-1
249,checking to see why flight 3466 (atl-ord) got Cancelled Flighted?,flight,airline,negative,20,26
250,"for an early flt, I think a call is appropriate. Yes, reviewed and nada avail until next day. Expect full refund",refund,service,negative,106,112
251,trying to add my boy Prince to my ressie. SF this Thursday from LAX,reservation,service,neutral,-1,-1
252,us too! Terrible airline! Just gave us a hotel hotline number and said sorry,airline,service,negative,17,24
253,I am all about the in flight artisanal cheese and wine pairing.,cheese and wine pairing,service,positive,39,62
254,Good point!,implicit,implicit,neutral,-1,-1
255,I am trying to book awards for September and need flights on but they will not show even w/ many award seats availab,flights,service,negative,50,57
256,I need to register a service dog for a first class ticket from SFO &gt; Dulles. The phone queue is an hour or longer. Pls advise,service dog,service,negative,21,32
257,Looks like a broken link for your assets,flights,service,negative,-1,-1
258,is saving my sanity right now:,sanity,implicit,neutral,13,19
259,Ok thank again for your help!,bags,service,positive,-1,-1
260,how do you lose a gate checked bag DEN to ORD? Direct flight. Ugh.,gate checked bag,baggage,negative,18,34
261,Hi! Just wanted to see if you have any new routes planned this year for Newark. Love flying you guys and hope to do so more!,routes,service,positive,43,49
262,Had to spend 5 hours worrying that items in carryon would be broken/stolen since I couldn't carry them on plane or lock bag.,carryon,baggage,negative,44,51
263,I wonder if sharing all this on FB and insta would produce a number. 140 characters really limits my story telling.,pilot,staff,negative,-1,-1
264,i have a weekend of dealing with your company that would say otherwise.,company,service,negative,38,45
265,called your service line and was hung up on. This is awesome. sarcasm,service line,service,negative,12,24
266,is flight 587 from DFW to ORD currently on-time? I see an advisory that DFW may be affected by weather,flight,airline,neutral,3,9
267,amazing to me that we can't get any cold air from the vents. VX358 noair worstflightever roasted SFOtoBOS,middle seat,seating,negative,-1,-1
268,and what am I suppose to do with that number?,number,service,neutral,38,44
269,pls properly train your agents. Requested to speak to 1k customer service and was transferred to a dead end. Not even open at this hr,agents,staff,negative,24,30
270,what's the point of asking for details about a servicedog when you book if your flight crew doesn't read them? (Continued),baggage,baggage,negative,-1,-1
271,I’m having trouble adding this flight my wife booked to my Elevate account. Help?,Elevate account,app,negative,59,74
272,"Anytime, sugafly.",service,flight,neutral,-1,-1
273,"Soooo, it's been 15 days and you've offered no response. So I assume poor treatment by gate agents is the norm now?",treatment by gate agents,staff,negative,74,98
274,Digging the swanky pink mood lighting during the flight from NYC to SFO. Just needs a cabaret singer. Think about it!,mood lighting,flight,neutral,24,37
275,it was UA flight 1001! Now I'm currently stuck in Portland because I missed my ride because of the 3 hour delay. GetMartyHome,delay,service,negative,106,111
276,thanks for effing up our holidays - we're missing a full day of skiing due to your baggage team's incompetence at,DM,service,negative,-1,-1
277,. ..I received on other flights. united truly breaks guitars. unitedbreaksguitars wantmymoneyback,guitars,service,negative,53,60
278,Results Handily Exceed Forecasts -,implicit,general,neutral,-1,-1
279,"Arriving 25 minutes early is nice, but not if equipment isn't ready. Waiting 30 minutes for luggage, so far. Time gains wiped out.",delays,service,negative,-1,-1
280,a brilliant brisk am in Boston in cue for vx363,flight,flight,neutral,-1,-1
281,Thanks!,schedule,service,positive,-1,-1
282,kudos for not Cancelled Flightling flights from DFW this morning. United usually first to panic...,flights,airline,positive,35,42
283,"tried calling too, but w/25 min phn wait means we'd miss options anyway",wait,service,negative,36,40
284,I wasn't asking for a full refund but delaying me 3 hours and giving no reason should be enough to give partial credit,credit,service,negative,112,118
285,I did DM the details but still no response. I have to book today.,property,baggage,negative,-1,-1
286,What's going on with your website? I'm Flight Booking Problems three tickets today and I've been booted off the system umpteen times.,website,technology,negative,26,33
287,How can I watch the Oscars2015 on my JFK-&gt;SFO flight?,flight,service,neutral,49,55
288,UA938 ORD-LHR. bags are being loaded 30min Late Flight. Frigid air into cabin! Plane feels like falling apart! Upgrade long haul fleet!,plane,service,negative,79,84
289,DM does not work what do I do?,TravelBank,baggage,neutral,-1,-1
290,please be good to me this weekend!,implicit,airline,neutral,-1,-1
291,I know this is probably a no but is there a way to get a cheaper airfare ticket if the flight is leaving in a few hours? 🙏,confirmation number,implicit,neutral,-1,-1
292,"well, considering every agent before claimed they were unable to help with everything else, why waste more time to hear 'call corp'",agent,service,negative,24,29
293,Lost bag process is broken. Agent promised they'd call and hold my bag when found. Now they're waking me at 3am w/ delivery. fail,lost bag process,baggage,negative,0,16
294,has been such a disappointment today. Simply put. Rather unpleased with things currently. Flight delayed; cant wait to just get home,United Airlines,airline,negative,-1,-1
295,"It's still a valid flight. Just seems strange to delay for Late Flight inbound crew, 7 hours from now, when the plane is already here.",flight,flight,negative,19,25
296,Had to explain to a very over eager flight attendant trying to ask about my vision that my was not a guide dog!,mechanical problems,flight,negative,-1,-1
297,worst2unitedflightsever UA1429 IAD to LAS 2/19 mechanical problems - switched aircraft delayed 3.5 hours!,service,service,negative,-1,-1
298,Why is the site down? When will it be back up?,website,app,negative,-1,-1
299,It's fine. Already done with my purchase. But you should try it. Just go most of the way through then go back 3,purchase,service,negative,32,40
300,"the ones who suffer. I understand delays, I don't understand trying speed up a process that has been delays to this extent.",process,service,negative,79,86
301,"hi! I just bked a cool birthday trip with you, but i can't add my elevate no. cause i entered my middle name during Flight Booking Problems 😢",hours of operation,service,negative,-1,-1
302,would love to do more for virgin just like I do for,implicit,general,positive,-1,-1
303,for the record- Rozana at Newark was lovely and helpful. choosekind,Rozana,staff,positive,16,22
304,"Hi, I'm trying to do check-in but the website is not working. I tried 3 different browsers and the problem continues",website,service,negative,38,45
305,there is something wrong with you website in Safari iPhone,website,airline,negative,34,41
306,still waiting to hear back. My wallet was stolen from one of your planes so would appreciate a resolution here,experience,service,negative,-1,-1
307,WTF is happening in PDX Late Flight March such that one way from SFO is ~$550?,flight,service,negative,29,35
308,I did... no response back,flight,service,negative,-1,-1
309,Do you guys know your check-in links from emails are broken?,check-in links,service,negative,22,36
310,you guys are perfect as always! &lt;3 WeRVirgin,customer service,service,positive,-1,-1
311,flt 1249 Cancelled Flightled and I get email :30 AM? What happened to courtesy phn call? Had to book diff airline and city,baggage,baggage,negative,-1,-1
312,already contacted Central Baggage and sent DM. is charging me for the dress that was in the lost suitcase help,baggage,lost luggage,negative,26,33
313,i left an item on the plane and have been calling non stop and no one has been answering can you please help,item,baggage,negative,10,14
314,I have an unused ticket but moved to a new city where you don't fly. How can I fly with you before it expires? travelhelp,ticket,service,neutral,17,23
315,plus you've added commercials to the experience... tacky.,experience,service,positive,37,47
316,"Funny story, your website is broken, you have missing javascript and stylesheets on the checkin process. I dislike this!",website,technical issues,negative,18,25
317,is flight 882 Cancelled Flightled and what do I do if it is?,flight,service,neutral,3,9
318,it's highly unprofessional for you to overbook a flight by 12 seats andfeel that I should rearrange my schedule for your mismanagement,flight,service,negative,49,55
319,Been trying since 1230 to file a report.,report,service,negative,33,39
320,to start 5xweekly A319 flights from to Dallas Austin on 28APR avgeek,earphone jack,service,neutral,-1,-1
321,so you're telling me there is no number to call after being left in an airport because of a negligent pilot and staff?,email,implicit,negative,-1,-1
322,kinda sucked my earphone jack didn't work on my flight. They may want to look into that for future passengers,route,service,negative,-1,-1
323,"not just refunded, but for those of us who are on vacation to get a free room night to make up for making us sleep in DIA",room night,service,positive,73,83
324,I don’t use Passbook =/ I still love you though &lt;3 :) I’ll just use my email in the future.,Passbook,app,positive,12,20
325,what happened to Doom?!,Doom,entertainment,neutral,17,21
326,lots of reports of system failures delaying flights over the last week. Currently sitting on the tarmac at OGG for over an hour.,flights,flight,negative,44,51
327,"no I don't, but I'm sure United have my info on its system.",info,service,neutral,40,44
328,Thanks for the lovely soft views! travel SAN to SFO,views,service,positive,27,32
329,so if I'm flying 1st class just one leg to Chicago but not on my long flight to China am I still able to use the lounge in Chicago,lounge,service,neutral,113,119
330,These are great fares!!!!!,fares,pricing,positive,16,21
331,for all my flight stuff wrong and did nothing about it. Had worst flight ever,flight,airline,negative,11,17
332,Can you give me Silver Status for 12 months?,Cancelled Flightlation fees,service,neutral,-1,-1
333,love the 90s music blasting at gate in Boston while waiting for flight to SanFrancisco. Only if I could get an iced coffee!,music,experience,positive,13,18
334,I did it but there was a problem in the link from the email for check-in. thanks,check-in,service,negative,64,72
335,". not only was it great, but you return my calls the day after. Couldn't ask for more. myVXexperience",customer service,service,positive,-1,-1
336,"the CSS on your site is a 404 right now, please fix. Site unusable.",website,service,negative,-1,-1
337,yes I do.,team,service,neutral,-1,-1
338,"Just trying to book tickets to NYC and facing super fun broken styling. Don't worry, I'll keep trying :)",tickets,booking,negative,20,27
339,"- thanks for your help...got me what I need, but its an issue with . I guess I sit awhile longer.",refund,service,positive,-1,-1
340,Calls to 800 resulted in 2hrs of hold time and 2day wait to check suspect code share fare. Nothing investigated—my time wasted (2/2),hold time,service,negative,33,42
341,really wish you'd fly out of Fargo those fares are amazings,sign up bonuses,service,positive,-1,-1
342,"Dear Virgin customer, while you're stranded in SF for 3 days and $1000cost- we'll do the very least we can to accommodate you!",accommodation,service,neutral,-1,-1
343,we just flew with United from AUS (Austin Bergstrom) to Cancun Intl. Best flight ever! The 737's are not too big... Not too small!,flight,flight,positive,74,80
344,come back to PHL already. We need you to take us out of this horrible cold. pleasecomeback,cold,implicit,positive,70,74
345,"This must be a drone “: We understand your frustration. Our Bag team is working hard to get your bag(s) to you...""",baggage,service,negative,-1,-1
346,ok. I just submitted. Thanks for the opportunity to give feedback.,baggage claim,service,positive,-1,-1
347,albanyairport delayed departure to check bags at gate claiming space filled and walk on to open spaces a delay poorcustomerservice,departure,flight,negative,22,31
348,Asked Flight attendant what typical compensation would be and says we might get free TV. Unacceptable,compensation,service,negative,36,48
349,man I can't wait to book my ticket now! Thanks JP you're a life sabe,ticket,service,positive,28,34
350,1k and had problem getting out of FLL to IAH sent DM to you about making my connection please let me know,1st Class service,service,negative,-1,-1
351,thanks,tickets,pricing,positive,-1,-1
352,Thanks for the reminder. It's been a fun ride.,ride,service,positive,41,45
353,I'm flying your fabulous Seductive skies again! U take all the stress away from travel,skies,service,positive,35,40
354,yes lots. You have terrible customer service at Newark and despite raising a complaint there we were ignored hence the tweet,plane,service,negative,-1,-1
355,4 passengers after a 2 hour delayed flight left with no hotel at the end of the night @ hou airport. Wtf??!!,delayed flight,flight,negative,28,42
356,I see what you did there ;),implicit,implicit,positive,-1,-1
357,my flight was delayed due to maintenance in LIT and caused me to miss my connection at IAH to MSY. Can you help?,flight,flight,negative,3,9
358,of course I did. The bag should be here by now :( frustrated,bag,baggage,negative,21,24
359,your no Late Flight bag check just lost you my business. I missed flight and AM apt. Three other people on flight had same exp.,business,service,negative,47,55
360,Thank you for that. Am I able to claim any interim expenses or is the cost of the stuff up on me?,interim expenses,service,positive,43,59
361,thank you !,flight crew,staff,neutral,-1,-1
362,What is your phone number. I can't find who to call about a flight reservation.,phone number,service,negative,13,25
363,everything was fine until you lost my bag,bag,baggage,negative,38,41
364,"but then again, maybe the would care more to hear what went on than whoever listens to issues you caused",story telling,implicit,negative,-1,-1
365,Thanks for remembering to load my bag onto my connecting flight. Oh wait you forgot. Iceland should be fun with no clothes....,bag,baggage,negative,34,37
366,"so loyal that I'm driving to NYC from PA, to fly Virgin, since you cut Philly flights ;)",flights,flight,positive,78,85
367,done,flight,flight,neutral,-1,-1
368,thanks again for your concern. I will contact customer care upon our return from Australia.,over booking,service,neutral,-1,-1
369,@ Denver International Airport,Denver International Airport,location,positive,2,30
370,flight home to dc sunset globe in' backtowinter back to work! refreshed,flight,flight,positive,0,6
371,well someone should tell that to the employees at the Denver baggage claim. Still no bag!!!!,bag,baggage,negative,61,64
372,this is too cool! Never been on ur planes but now I will!!,fares,pricing,positive,-1,-1
373,it's like you're trying to make me hate your airline. Fee for each checked bag that's never mentioned in the ticket + rude agents 👿,airline,service,negative,45,52
374,wish I can afford to fly with you next Friday going back home.. love everything about your airline,airline,service,positive,91,98
375,I sure did. I had to drive a total of 3 hours to get my own bag. I'd like to explain that debacle but no one wants to talk to me.,bag,baggage,negative,60,63
376,"It's an incredibly easy fix, but you would rather stay in your comfort zone, while I get forced out of mine.",tickets,booking,negative,-1,-1
377,"Late Flight to Denver, Late Flight to Newark...let's not even get into the disaster that was checking bags. Unacceptable.",checking bags,baggage,negative,93,106
378,I've applied more then once to be a member of the inflight crew team...Im 100% interested. flightattendant dreampath -G,inflight crew team,staff,positive,50,68
379,shares rise on Q4 financial results - USA TODAY,financial results,implicit,neutral,18,35
380,the people at the counter have been very helpful. As you can see nobody is there. Flight to Austin 10:55 and still sitting here.,counter staff,staff,negative,-1,-1
381,"also, the mere fact that I have to go online to issue a statement vice calling and talking to some directly is one good example.",statement,service,negative,56,65
382,We've had a ton of problems with getting our bags and have been given the run around for a day. Whats up with that?,luggage,service,negative,-1,-1
383,So do I need to book two one ways in order for her to fly as an unaccompanied minor?,unaccompanied minor,policy,neutral,64,83
384,I have 2d and 3d embossed badges and patches superior to the ones you are currently using.,badges and patches,service,negative,26,44
385,my goodness your people field are amazing under pressure ❤️from Texas beatstheothers in crisis Please fly me to NY,people,staff,positive,17,23
386,terminal at MIA should have food open before 5am esp when there are flights at 6am. Two hours early like recommended. Can't eat.,food,service,negative,28,32
387,Male agnt in LAS threatens Canadian cust when cust takes pic of him at gate after agents announce can't help rebook. friendlyskies?,employees,staff,negative,-1,-1
388,the os isn't controlled by me but rather . App is new.,app,technology,neutral,43,46
389,If only you guys had flights from CMH.,flights,airline,neutral,21,28
390,is the website down?,website,service,negative,7,14
391,seriously fail on making strangers share a room,room,service,negative,43,47
392,Just checking in again - what is the status of our claim. It is going on 2 months with no attention to this? We are very upset.,claim,service,negative,51,56
393,: We don't like to hear you had a poor experience. Please share details w/our Customer Care team,experience,experience,negative,39,49
394,Mobile boarding pass disappeared from phone while standing in line to board. Second time this week... Hmm.,boarding pass,technology,negative,7,20
395,Julie Andrews all the way though was very impressive! NO to,implicit,implicit,positive,-1,-1
396,"I am buying 2 yo own seat on 3 legs of intl trip, car seat? Required? If not- then allowed? Can child still sit w/mom after takeoff?",car seat,service,neutral,50,58
397,"I've sent the message, let me know if you got it. I'm not very twitter-literate. Also, is he REALLY going to be stuck for 18hrs?",customer service,service,negative,-1,-1
398,"Follow me back, please, and I'll happily DM you the link because I'd rather not share my travel plans publicly.",airline,service,neutral,-1,-1
399,"v upset with your disability ""services"". When I told one of your employees I was carrying medical equipment she was very rude.",services,service,negative,30,38
400,"mood lighting on point🙌 Reclining my seat, kickin up my feet💤",staff,service,negative,-1,-1
401,happy to spend the day together. Let's do this!,day together,service,positive,19,31
402,", the only airline based in Silicon Valley! disruption FCmostinnovative incubator 's",airline,service,positive,11,18
403,"If it's any consolation, your staff was stellar. Just not the hour+ delays I encountered with every one of my 4 flights.",flight,flight,negative,112,118
404,Flight from BOS &gt; LAS tomorrow was Cancelled Flightled. No notification; wait times are 1+ hour. Will you rebook on another airline?,Flight,airline,negative,0,6
405,why Cancelled Flight flights today? No precipitation to be scared of! ❄️❄️❄️,flights,service,negative,21,28
406,Man of steel flies to more cities though...and with more frequency too.,cities,destination,negative,27,33
407,"Never had a bad experience before, but this one took the cake. Now extortion for carry on items as well?",carry on items,baggage,negative,81,95
408,Yo yo yo stuck on the tarmac for over 2 hours at ... Going to miss my ride at help please! HelpImStuck United,tarmac,service,negative,22,28
409,Because we never rec'd Cancelled Flightlation notice we were left w no options to fly out of PS. Driving to LA for a red eye Mon w kids,flight,airline,negative,33,39
410,this is great news! America could start flights to Hawaii by end of year via,moodlighting,experience,positive,-1,-1
411,awesome I'll book my next Christmas vacatinn this December any other ways you want to devalue mileage plus.,mileage plus,loyalty program,positive,94,106
412,my flight (6000) scheduled for 1pm departure still says on time but no plane at gate. Any update on how long of a delay?,elevate points,service,negative,-1,-1
413,"thanks! It's 35K miles from RTB to Europe, to do a multiple destination so we could stop over in US on way/way back- mileage diff?",miles,service,neutral,17,22
414,landed in Boston at 9 last night. The 15 hours of traveling was rough tho.,traveling,experience,negative,50,59
415,why can't you supp the biz traveler like and have customer service like neverflyvirginforbusiness,customer service,service,negative,50,66
416,"question:are there onboad 110 volt outlets in all planes? If so, where?",website,app,neutral,-1,-1
417,"I'm rebooked now, but the line was 300 people deep.",baggage,service,negative,-1,-1
