id,text,aspect,category,polarity,from,to
418,about 3 hours ago. I need to work out if my bag can make it to my hotel here in time or if it will need to go elsewhere.,bag,baggage,negative,44,47
419,Greetings. UA Club member here. Any idea if I can use the Air Canada Lounge at YVR. Flying UA tomorrow.,Air Canada Lounge,lounge,neutral,58,75
420,That's correct—I've spent hours trying to book online only to receive an error when clicking final purchase button. (1/2),booking online,app,negative,-1,-1
421,where's my damn bag??,bag,baggage,negative,16,19
422,"despite shaky connections, looks like I'll get home tonight. Great job, - was touch and go for a while..",connections,flight,positive,14,25
423,In the process of recovering their car rental - condo rental $ in Florida. They called United for an alternate flight NOANSWER,flight,flight,negative,111,117
424,"Thank you, ^JH, appreciate the prompt responses--me and other passengers will be doing so.",staff,service,neutral,-1,-1
425,nervous about my flight from DC to LAX getting Cancelled Flightled tomorrow! Just sent you a DM to help me!,flight,service,neutral,17,23
426,"hi, i did not get points on my elevate account for my most recent flight, how do i add the flight and points to my account?",Cancelled Flight,flight,neutral,-1,-1
427,It's too bad UA has had another unforeseeable operational issue on my return flight.,operational issue,service,negative,46,63
428,“: We'll see what we can do. ^KN” We are running! Most of this plane is running. Thanks for the help!,plane,flight,positive,63,68
429,your assistance yesterday when u Cancelled Flightled our flight was to give us a hotel hotline Shame on you!,hotel hotline,service,negative,81,94
430,I was denied getting on the plane w/o getting the chance to prove it fits. I'm not a rookie. Read my bio.,boarding,service,negative,-1,-1
431,do you have an application for iOS? Was looking and only saw Virgin Mexico :( &lt;/3,application,app,neutral,15,26
432,really? Someone called in sick and then someone FORGOT to call a replacement?! Now an hour Late Flight to take off. theworst,Late Flight,flight,negative,91,102
433,"if the car seat is lost should just reimburse me for a new one, this is not a pair of shoes, it's a necessity for my child",car seat,baggage,negative,7,15
434,"as a 1k, I'm always hoping for improvement.",improvement,service,negative,31,42
435,your inflight team makes the experience amazing!,experience,airline,positive,29,39
436,", am I dreaming? Did you really just open up a route between Dallas and Austin?! And does this mean Houston might be next?",route,service,positive,47,52
437,After our unscheduled refueling stop and missing 2 connecting flights we r home n looking 4ward to our bed and a big PBandJ sandwich.,refueling stop,service,negative,22,36
438,Yes. Did file a claim as soon as the carousel stopped without my bag on it. Got an email that its found but not sched for delivery,Delay,flight,negative,-1,-1
439,"iah to charlotte. Baggage claim rep latrice h. customerservice non existent, Ignored customer then inappropriately touched customer",overhead bin,baggage,negative,-1,-1
440,that doesn't look to fat to me! It looks yummy!,flight,flight,positive,-1,-1
441,OMG FINALLY,flights,service,positive,-1,-1
442,"I just sent an email to Customer Care, telling them I may have to break up with you 😢. I sincerely hope they can help me!!",Customer Care,service,negative,24,37
443,I see you guys are at it again. Amazing how one company continually makes mistakes yet fails to be held accountable for their error,mistakes,airline,negative,74,82
444,thnx for quick reply but don't think you can assist. Our intl grp will be put to considerable inconvenience today.,inconvenience,service,negative,94,107
445,I was so glad it was mentioned. I took my first virgin flight a few years back and it was a transformative experience.,flight,service,positive,55,61
446,has once again let me down. Don't think I've ever flown with them and not had problems. Worst airline period.,airline,service,negative,94,101
447,thanks for taking care of on her flight!! rockstars travel,implicit,general,positive,-1,-1
448,I am deeply disappointed that your birthday promo was not applied to a trip I booked mere days before I received the email,promo,service,negative,44,49
449,will not have to honor absurdly low mistake fares. vía,mistake fares,pricing,neutral,36,49
450,It was last night's 1235/ORD-LGA.,flight,flight,neutral,-1,-1
451,yes please! Trying to get to POP- in Newark now....,entertainment system,service,neutral,-1,-1
452,Can you please follow for a Dm on a missing bag?,missing bag,baggage,negative,36,47
453,"UA 746. Pacific Rim and Date Night cut out. Not constantly or randomly, but one spot, repeatably.",entertainment,service,negative,-1,-1
454,diverted and missed our connecting flight. Was just told that my bag is on it's way to MSY. If you only had people that cared,connecting flight,flight,negative,24,41
455,"just promoting the product is all, had a problem with southwest and recommend noneother than the best!",routes,service,positive,-1,-1
456,I love the hipster innovation. You are a feel good brand.,innovation,branding,positive,19,29
457,rude rude,rudeness,staff,negative,-1,-1
458,"good to know you will open the closed doors for ""premier passengers"" after safety briefings on delayed flights. annoyed.",premier passengers,service,negative,49,67
459,😎 RT : You’ve met your match. Got status on another airline? Upgrade (+restr):,airline,airline,positive,52,59
460,thank you for checking in. tickets are purchased and customer is happy ;-),customer,service,positive,53,61
461,"spending my birthday night with you, DAL-DCA. Get me home!",flight,service,negative,-1,-1
462,you too!,implicit,implicit,positive,-1,-1
463,"hi I just booked a flight but need to add baggage, how can I do this?",baggage,baggage,neutral,42,49
464,to battle on - route via,nerdbird,service,neutral,-1,-1
465,"is horrible!! They lost our carseat and expect us to use a loner carseat, safety regulations say it's illegal to use a used car seat",carseat,baggage,negative,28,35
466,Will flights be leaving Dallas for LA on February 24th?,implicit,implicit,neutral,-1,-1
467,"For my Grandma Ella's 80th, she would &lt;3 a bday greeting from your flight crew! She was a stewardess for Eastern Airlines.",bday greeting,service,positive,46,59
468,worst2unitedflightsever UA 236 LAS to IAD 2/24 mechanical problems again - took off - had to land for fix - delayed again wtfodds!,seats,seats,negative,-1,-1
469,I left my comment with customer care. Thanks for contacting me.,customer care,service,positive,23,36
470,". it will be because I'm moving to because of talk, no service",service,airline,negative,55,62
471,another fail for the United ticket agents in OKC. LESS than helpful and could care less about our problems. American here we come.,ticket agents,staff,negative,28,41
472,this is atrocious customer service.,customer service,service,negative,18,34
473,is that thestarter??😁,flight,service,neutral,-1,-1
474,I will but right now I'm to angry,communication,service,negative,-1,-1
475,thank you.,service,service,positive,-1,-1
476,When will email address/username sign-on be available? It's been a while.,sign-on,app,negative,33,40
477,please upload the March on-demand entertainment listing on your website! ✈️,entertainment,service,neutral,34,47
478,yall should probably work on that.,issues,airline,neutral,-1,-1
479,Please help... I am in Ethiopia adopting a two year old child. Have an existing confirmation . Need to add child to reservation.,outlets,seats,neutral,-1,-1
480,UnitedAirlines Pls Fix AspenBaggageFail issues. Had to pay my own way to Aspen after flight Cancelled Flight. Left us in the cold in DEN.,baggage,baggage,negative,28,35
481,"See? We were told repeatedly that the pilot was Late Flight and kept getting Late Flightr. After we boarded, there was a defibrillator issue.",pilot,staff,negative,38,43
482,Our vacation's going to be ruined w/ 3 days of rain. : ( The change fee for 2 of us is nearly cost of original flight. Can you help?,change fee,service,neutral,61,71
483,. does that mean you don't have a policy for destroyed luggage?,luggage,baggage,negative,55,62
484,we needed them here asap. Will they make it on today's flight?,flight,service,negative,55,61
485,"I spoke with a representative that offered no solution, I am a loyal customer who flies on as well",representative,service,negative,15,29
486,Stressed and rude agents. Overwhelmed by delyd flight LAS-DEN 1657. Yelling at several people. Not pretty. This is friendlyskies??,agents,staff,negative,18,24
487,"View of downtown Los Angeles, the Hollywood Sign, and beyond that rain in the mountains!",flights,service,positive,-1,-1
488,"it was amazing, and arrived an hour early. You're too good to me.",arrival,service,positive,-1,-1
489,no Cancelled Flightn just left us to fend for ourselves when flt came in Late Flight. Getting runaround for 3 hrs. Each employee blaming previous 1.,employees,staff,negative,-1,-1
490,. I don't understand why you need a DM to give me an answer on if you have a damaged luggage policy.,luggage,baggage,negative,85,92
491,"again I ask, who can I call to get this fixed? Tweeting me BS questions to stall only makes things worse. Phone number please.",phone number,service,negative,106,118
492,"all are great , but I have to go with CarrieUnderwood 😍👌",CarrieUnderwood,entertainment,neutral,38,53
493,well that's big of you but I don't have terribly high expectations at this point.,expectations,service,negative,54,66
494,"Change made in just over 3 hours. For something that should have taken seconds online, I am not thrilled. Loved the agent, though.",agent,staff,negative,116,121
495,then why have I not received my call back its been 3 days...it's an infant car seat how am I supposed to go anywhere with my child,gate,airport,negative,-1,-1
496,what is going on with customer service? Is there anyway to speak to a human asap? Thank you.,customer service,service,negative,22,38
497,Yes!! Thanks so much!!! 💜“: We see you spoke with our Reservations team and they've reinstated the flight. Thanks. ^EY”,flight,flight,positive,99,105
498,I was really looking forward to my flight. can you let me know when it will be rescheduled? diehardvirgin,flight,service,negative,35,41
499,I think DM would be better,app,service,negative,-1,-1
500,"my luggage is gone. I've filed my paperwork, promised a call/email. Still no resolution or response from central luggage.",luggage,baggage,negative,3,10
501,comically on the return flight from ASE there were two United flights boarding at adjacent gates and not clear which plane to board,boarding,flight,negative,70,78
502,I ❤️ flying . ☺️👍,flight,travel,positive,-1,-1
503,Another delayed flight? likingyoulessandless,flight,service,negative,16,22
504,"not worried, it's been a great ride in a new plane with great crew. All airlines should be like this.",plane,service,positive,45,50
505,"All of group E was told there was no more room in the bins. when I got on the plane, was room for at least 4 bags in my row!",bins,baggage,negative,54,58
506,your airline is awesome but your lax loft needs to step up its game. $40 for dirty tables and floors?,lax loft,service,negative,33,41
507,how can your app show arriving aircraft is early but departing flight is delayed due to Late Flight arriving aircraft?,departing flight,flight,negative,53,69
508,Atlantic ploughs a lone furrow in the MiddleEast,support ticket,customer service,neutral,-1,-1
509,I would love if someone could get me back to Austin tonight and I do not wish to wait til tomorrow morning.,agents,staff,neutral,-1,-1
510,"however, is completely under your control—the price was and still is displayed on",price,service,negative,46,51
511,on flight VX399 headed to LA from JFK - dirtiest VA plane I have ever been on. Sad for a great airline.,plane,cleanliness,negative,52,57
512,ok it's now been 7 months waiting to hear from airline. I gave them quite a bit more than the 30 days requested! Terrible service,service,customer service,negative,122,129
513,"tag numbers 0016 964012, 0016 964077, 0016 964078 - let's find these bags.",support staff,staff,negative,-1,-1
514,missed my flight. How does standby work?,missed flight,flight,neutral,-1,-1
515,and it's a really big bad thing about it,thing,implicit,negative,26,31
516,That's not the issue. The fact that no one even called (despite promises) to confirm the bag's location is.,baggage,baggage,negative,-1,-1
517,"first time flying Virgin, went to SanFrancisco .Thanks for the smooth ride. Easily my new fav airline!",flight,service,positive,-1,-1
518,searched for mileage tickets to BOM couldn't find a single one is saver awards - I see how you play. Earn miles but can't use them.,flight name change,flight,negative,-1,-1
519,thanks guys! Sweet route over the Rockies airplanemodewason,route,flight,positive,19,24
520,don't see a justifiable cost to get on an early flight with seats. No airline charges to conveniently get their passengers in early,seats,service,negative,60,65
521,flight 404 delayed 2 hours in LA due to mechanical problems. Handle like pros but you could have tossed us a free drink.,flight,service,negative,0,6
522,any updates on flight 413 from Jfk &gt; Lax,flight,flight,neutral,15,21
523,how do I get my account number if your website says email is unavailable?,account number,account management,negative,16,30
524,"has unrivalled access to California with flights to the U.S. from 7 UK airports, with nonstop or one-stop connections year-round",flights,airline,positive,41,48
525,cutest salt and pepper shaker ever. Just when I think you guys can't get any better you just do!,salt and pepper shaker,implicit,positive,7,29
526,"of urgency, but this is ridiculous. Your ceo claims to be customer focused, yet when delays happen, planes sit and customers are",delays,service,negative,85,91
527,what time? Who can I call. I need my skis. I will go to the airport and get them. No more faith in United.,skis,baggage,negative,37,41
528,Thank you!,flight,service,positive,-1,-1
529,too bad you say it takes 10 to 14 days via YOUR confirmation email. When I inquired after 3 weeks you claim 6 to 8 weeks!,confirmation email,airline,negative,48,66
530,why must a traveler miss a flight to Late Flight check a bag? I missed my morning appointments and you lost my business. sfo2lax,flight,service,negative,27,33
531,LHR arrival lounge fail. Waited 20 mins for shower then left to find hotel. U know how many passengers u carry. Planning???,arrival lounge,service,negative,4,18
532,Congrats VX on the new route! ✈️🎉,route,service,positive,23,28
533,what is your policy on flying after surgery? I am still waiting for answer so I can tell me doctor.,policy,implicit,neutral,13,19
534,airlines is the absolute worst. They have no idea what they are doing. neveragain UnitedAirlines,airlines,airline,negative,0,8
535,Well the bar is set low! You guys are really good at the apology game! What will change? When will u guys learn?,disappointment,service,negative,-1,-1
536,add DTW and I'm sold!,DTW,route,neutral,4,7
537,thanks for the free birthday points! y'all are ALL RIGHT with me!,birthday points,service,positive,20,35
538,​ is flying from Love to Austin now. That is most excellent news.,flight,service,positive,-1,-1
539,to speak to a real person to get this resolved politely and efficiently. (2/2),plane,airline,negative,-1,-1
540,booked flights for 2 for $779. Was charged $389.50 twice. Means I can't redeem CC points properly. Would have gone elsewhere.,bags,service,negative,-1,-1
541,Like,implicit,implicit,positive,-1,-1
542,I was originally trying to share details but the link Jimmy Samartzis Vice President - Customer Experience sent me expired.,link,technology,negative,49,53
543,Have clients with an 11 hr layover at IAH (during the day). Will they have to claim and recheck luggage. Or will it be taken care of?,car seat,baggage,neutral,-1,-1
544,still no refund or word via DM. Please resolve this issue as your Cancelled Flightled flight was useless to my assistant's trip.,service,service,negative,-1,-1
545,at Logan airport and waiting to checkin for my 9am flight. Checkin desk not open !!!!! Why?!,check-in,service,negative,-1,-1
546,thanks!,flight,airline,positive,-1,-1
547,all crap channels which is why I pay to watch UK tv,slots,service,negative,-1,-1
548,"I will, as soon as I am done with my article. Thanks! ~Tom",flights,service,positive,-1,-1
549,I can't DM you so here's the confirmation G8CVWJ - please is there any way I can make it to Kailua tonight? Thank you,boarding time info,service,neutral,-1,-1
550,"I understand, but it's tough when there is no way to get to the airport w/o serious risk of an accident. It's a steep price.",flights,travel,neutral,-1,-1
551,What said.,commercials,entertainment,neutral,-1,-1
552,why don't any of the pairings include red wine?! Only white is offered :( redwineisbetter,red wine,beverage,negative,38,46
553,ours in July. You have ZERO excuses for this. You have an out-of-date system that causes problems like this.,flights,travel,negative,-1,-1
554,"Nope. Walked up and down the ORF terminal, and not a United agent to be found. Showed up @ last minute to board us. Many panicked people",personal time,experience,negative,-1,-1
555,current bug on website shows ‘select departure city’ when selecting destination city,website,service,negative,15,22
556,your Avis rental continue button doesn't work on your website to book car. Tried 4 times on phone. This sucks!,website,service,negative,54,61
557,the aircraft closest to gate was for the other flight and the one closest to our gate was going to Chicago.,aircraft,flight,neutral,4,12
558,thx for update,flight attendant,staff,positive,-1,-1
559,I love the dancing little richard. cool beans.,implicit,implicit,positive,-1,-1
560,Just sent thank u RT : Please DM your confirmation number if reFlight Booking Problems is needed. Thank you. ^EY,rebooking,service,neutral,-1,-1
561,Keep up the great work :),work,service,positive,18,22
562,"I tried that. You offered to charge me an additional $1k for a new ticket or be stranded until Thurs. 1st time, last time.",ticket,service,negative,67,73
563,Pls Help Baby Hannah get the life saving surgeries she requires.She needs your help.Pls Donate/RT,help,support,neutral,4,8
564,follow me please this airline is beautifull ♥,airline,service,positive,22,29
565,AND my luggage has been broken!! youcouldntmakethis up brokenwheel,luggage,airline,negative,7,14
566,just flew to TelAviv paid $100 from a third suitcase which didn't even make it on the plane! Besides for the impolite service...,suitcase,baggage,negative,44,52
567,After last night tribute SoundOfMusic Oscars2015 ! I think agree,implicit,implicit,neutral,-1,-1
568,The Flight Booking Problems section of your website seems to be broken on Chrome. Might wanna look into that.,Flight Booking Problems,service,negative,4,27
569,you know it. Need it on my spotify stat guiltypleasures,implicit,implicit,positive,-1,-1
570,BIG Love/gratitude.mpower w/ weRin OSCARS2105 VIPswagbags@ AvalonHollywood,seat,seating,neutral,-1,-1
571,"Beats EPS Views, Takes On SouthwestAir VA LUV - Investor's Business Daily",business,service,neutral,59,67
572,any plans to start flying direct from DAL to LAS?,air travel experience,experience,neutral,-1,-1
573,"in addition, my first flight was delayed an hour and I'm arriving at my destination 8 hrs Late Flight.",flight,flight,negative,22,28
574,"Ice, which I totally understand. But when a large number of us are facing 15+ hours of time and overnight Cancelled Flightations it seems like",Cancelled Flight,flight,negative,106,122
575,I hope so too,carry-on,baggage,neutral,-1,-1
576,best customer service rep in the world! irmafromDallas takes the cake!!!,customer service,service,positive,5,21
577,I appreciate your efforts getting me home!,home,service,positive,37,41
578,i need to change my flight thats scheduled in 9 hours and 120 min wait time on phone. Im calling intern. Help!!,flight,service,negative,20,26
579,"gives positive outlook, but sees increased competition -",competition,market,neutral,43,54
580,already did that at the airport and 12 hrs Late Flightr its still not here! you guys are really killing me today. trying to stay positive..,Late Flight,flight,negative,43,54
581,wish you flew out of Atlanta... Soon?,flights,service,neutral,-1,-1
582,Nice to see you expanding in Texas but don't forget about us here in SanDiego. I would love to see more flights out of here!,experience,service,neutral,-1,-1
583,thnx for the info,info,implicit,positive,13,17
584,can’t access your website from Safari on iPhone 6. Seems to work on Mac and iPad. Need iPhone to add Passbook.,website,service,negative,18,25
585,Dmed you. Thank you,direct flights,flight,negative,-1,-1
586,"It's taken ~3 weeks for Cust Care to respond to Case 8477733, requesting a refund for wi-fi not working. Where can I get an update?",refund for wi-fi,service,negative,75,91
587,still waiting to see 😞,refund,service,neutral,-1,-1
588,wow this just blew my mind,implicit,implicit,positive,-1,-1
589,thanks so much for sharing. Just added it to my site,implicit,implicit,positive,-1,-1
590,Other carriers are less than half price for a round trip fare. I am stunned.,fare,pricing,negative,57,61
591,question: is it not possible to book a seat for an infant under 2? It's not giving me the option but we want a seat for him.,seat,seating,negative,39,43
592,"I will give you one thing, you are consistent but unfortunately you are consistent at not doing your job well AlwaysDelayedOnUnited",service,service,negative,-1,-1
593,where is my flight voucher?,flight voucher,service,neutral,12,26
594,thank you,customer service,service,positive,-1,-1
595,thankyou the DAL-AUS route makes my day!!!!,competition,implicit,positive,-1,-1
596,FAIL You Cancelled Flightled our flight frm GJT and then used our reserv home to IAH (from SEA) for reFlight Booking Problems w/out OUR PERMISSION!! PH6RPS,flight,service,negative,19,25
597,"captain ""on behalf of the front office, welcome on board."".... Never heard that before. I laughed...hard. funnycaptain",captain,staff,positive,0,7
598,"We're on flight 910 Vegas to Boston today, checked in online but our bag count didn't register. Can I fix that somehow?",baggage,baggage,negative,-1,-1
599,Need to start flying to . 😊😀😃😄,implicit,general,neutral,-1,-1
600,"really? 3 hr delay, 4 gate changes, and you boarded us, sent us back up, and boarded us again. Won't change our flight. Can we go now?",delay,service,negative,13,18
601,Woke up to notification- flight moved 1.5 hrs early. Barely made flight then 3 hrs layover in SFO - wanted to hop on earlier option,flight,service,negative,25,31
602,Read my bio. See who I work with. I have NEVER encountered this with your airline before. Disappointed is an understatement.,airline,airline,negative,74,81
603,adds Austin-Dallas Love Field route.,route,service,neutral,30,35
604,"Hey why does the flight from IAH to POS leave so Late Flight, and the one back to IAH so early? I rather get to POS earlier",flight,flight,negative,17,23
605,When will direct flights from Belfast Intl to Newark resume from their winter break? Thanks.,travel,experience,neutral,-1,-1
606,you will match my AmericanAirlines status? Cool!,status,airline,positive,35,41
607,I lost a voucher that I was given in Miami aeroport on jan 26. I did not use it.,voucher,service,neutral,9,16
608,Thank you for the cheese platter and abundance of entertainment options. Time just flew by.,entertainment options,service,positive,50,71
609,Flight Booking Problems flight to uphold my status match. Do taxes on ticket count as earned status points? statusmatch virginamerica,flight booking,service,neutral,0,14
610,Made the upgrade list. Will fly 1st tomorrow (for 40 min) for the first time ever! 🙌 StatusMatchPaidOff,upgrade,service,positive,9,16
611,I'm elevategold for a good reason: you rock!!,service,staff,positive,-1,-1
612,on 4124 arriving two hours Late Flight into CLT. Now sitting on the tarmac while they move a plane from the gate. Unhappy customer.,Flight,flight,negative,32,38
613,"done! Thank you for the quick response, apparently faster than sitting on hold ;)",response,service,positive,30,38
614,Do you have any flights with lie flat seating from STL to PDX around the date of March 5?,compensation,service,neutral,-1,-1
615,Gee that's like almost caring about ppl more than $$. Think I'm more int in having a trusted adult w/ daughter .,trusted adult,service,neutral,85,98
616,"at its worse. Can't figure how to pack plane, screws up connectns then claims no hotl rooms in San Fran for stranded pax. Way to go!",hotel,service,negative,-1,-1
617,go to hell,delays,flight,negative,-1,-1
618,"customer service is atrocious! You have disrupted my travel plans, you have lost my luggage and it is impossible to TALK TO A HUMAN",customer service,service,negative,0,16
619,seats in Row 8 don't recline should mention that on your website soreback,seats,service,negative,0,5
620,"I was told it was due to be on UA23 which flies direct to Dublin, so why did it go to London? This is a complete shambles!",baggage claim,service,negative,-1,-1
621,what time does check in open for flight no UA80 from Manchester to Newark today ?,check in,service,neutral,15,23
622,I have no interesting flying with you after this. I will Cancelled Flight my next four flights I planned.neverflyvirginforbusiness,Cancelled Flight,flight,negative,57,73
623,"has getaway deals through May, from $59 one-way. Lots of cool cities CheapFlights FareCompare",deals,service,positive,12,17
624,Can you find us a flt out of LAX that is sooner than midnight on Monday? That would be great customer service 😃,customer service,service,neutral,93,109
