id,text,aspect,category,polarity,from,to
70,"The infection cleared Loss of appetite, heartburn, nausea,light headed feeling, gas, bloating,did not sleep well, 2 episodes of extreme dizziness (side-effects were most extreme at mid-point - 5 days. About 7-10 after completion I developed a vaginal yeast infection, which was cleared with over the counter medication. The cat bite on my foot was very swollen and painful. I was hospitalized for 4 days, during which time antibiotics were administered intravenously every 6 hours. When I was discharged from the hospital I felt fine, without any of the symptoms described above. When I started taking the Augmentin there were very few side-effects - they became very noticeable after the 5th or 6th day. By the end of the treatment, the dizziness had subsided as did the light headed feeling, but the intestinal discomfort remained until 3 or 4 days after.",augmentin,cat bite infection,positive,606,615
71,"none apparent Over the course of three nights, within an hour or two of first taking it, I had heart palpitations, confusion, inability to concentrate, problems balancing, extreme tiredness, lasting muscle weakness, nightmares and sleeplessness, anxiety, rash, a sureness I was dying and not even caring! I have never had a reaction to any drugs, and I am furious that a drug like this would even be on the market. I think my doctor was very irresponsible to prescribe this antibiotic without first having me try something else. I am now taking Clarithromycin and am doing fine with this drug. The mental side effects of Avelox have now disappeared, five days later, but I am still very weak and my joints hurt.",avelox,sinus infection,negative,621,627
72,"Heartburn/Acid reflux stopped the first day I took it. I haven't had any issues with heartburn or acid reflux whatsoever. Stomach pain (from possible ulcer-haven't had results back from test to diagnose that) has decreased significantly. No side effects that I know of, however my father (who also takes protonix) had to discontinue his regimen for a week because of a test he had to have done said his acid reflux came back about 2 days after he stopped and it was 10x worse than it was before treatment. I guess this isn't a drug one should go off of completely. I pill a day and all has been well. =D",protonix,possible ulcer and acid reflux,neutral,304,312
73,"My acne has completely dminished...i have the occasional break-out, but on a an everyday consistent basis i am now acne-free due to Retin-A! It helps to take a break while using it because your skin will become used to it, however after a few weeks off, the effects are just as wondederful to your skin as when you first began. Peeling, dryness, sun sensitivity I applied a small amount of Retin-A every evening before bed and washed if off in the morning. If you are able to get through the initial stage which includes the side effects (peeling, dry skin, redness, irritation, and sun sensitivity) your skin will emerge better looking and healthier in the end.",retin-a,acne,neutral,132,139
74,"The benefits was getting off of drugs. I go to a methadone clinic and i PAY $13 a day and i have for the last seven years. It helped me get off of Oxycotin's, but i would NOT recommend staying on it for long.. Because methadone is more addictive than pain pills. passing out; falling asleep drowsiness, weight gain when i first started i had alot of nausea, but after a few months it was better. When i first started going to the methadone clinic, i had to go there withdrawing. I had to take a physical and a drug test when i started. You can fail the first test, because they know you would have drugs in your system. I had to pay $154 when i first started and i pay almost $400 a month, which equals out to be $13.50 a day. I get drug tested every month and i have passed so many that i get ""take homes"". I only have to go there once a month now and i have to see my counslor for an hour each month and get drug tested. I get called in for random drug testing. I have to bring my bottles in so they will know that they are ""straight"" so they know i am not selling them. They do that to everyone. I have been there for seven years now and i am 26 years old. WHen i first started, i had to drive 1 1/2 hours a day for seven days a week for three months and then i got one take home. after three months of passing drug tests: 1 take home 6 months: 3 take homes one year: 5 take homes 1 1/2 years: a weeks worth 2 years: 2 weeks worth 2 1/2 years: a months worth.... I had to drive so much where there isn't many clinics in the states and i had to drive that far just to get to mine. I have been doing good and being strong. I just wish i would have lowered myself down after about 6 months. So now i am addicted to methadone. It is just legal and cheaper for me then pills and i know i get it everyday. I hope i helped. Thanks. :)",methadone,addiction,neutral,49,58
75,"the medicine in the beginning provided about 30% relief in pain, but as time progressed it only provided about 10% pain relief. This being said, it does provide some mental relief from chronic pain. and it relieves some of the muscle stiffness. When I do not take this medicine it puts me in a bad mood and causes my stomach to ache (like bad hunger pains even though I am not hungry). After I take the medicine these symptions disappear. Its almost like withdrawal. Medicine was prescribed to be taken twice a day in combination with physcial therapy for back condition.",ultram,back pain,positive,-1,-1
76,"The leg clot would not extend nor would other clots form, potentially causing death. These were severe and included extreme and continuous nausea, feeling generally shitty (technical term employed by patient), no libido and inability to maintain erection during sex, orgasms that petered out and gave little pleasure, no overall energy for life. Patient decided to stop medication and try natural/alternative substance to thin the blood. this resulted in an extension of the clot and increased severity of pain, leading to emergency room visit and subsequent use of different blood thinner, syntron. Treatment included 2months of heparin injections in abdomen. Coumadin was given daily after the injections were stopped, at 6mg. The discontinuation of this medication caused an extension of the clot and re-admittance to hospital and another drug for blood thinning was given. Eventually, 6 months later, a doctor prescribed a compression stocking, which helped dramatically with swelling and pain. The Syntron blood thinner had no noticeable side-effects. Except possibly a still reduced libido.",coumadin,"leg blood clot, dvt",negative,661,669
77,"The benefits were almost non-existent. I had taken this med before after a terrible car accident and therefore felt secure enough to take it again this time. However after only one day medicine stopped being effective. Some drowsiness at night after taken it throughout the day and some constipation. However after taking it for only two weeks I had a seizure that sent me to hospital and was told by doc there that elavil and tramadol combined can cause seizures! NO ONE told me this. Not my primary care doc, my GI doc or the pharmacist. This seems to me to be a pretty severe ""side effect"" for a medicine that barely works! The two meds were prescribed to me by the same physician and I understand oversights can happen. However if I had known from beginning that seizures might be a possibility I would asked for something else. Also after only two weeks I had some weird effects after stopping usage including diarrhea, cold sweats, hot flashes, restless leg syndrome and anxiety. I never experienced anything like this with any other meds. This medicine is NOT worth it! 1 to 2 50mg tablets every 4 to 6 hours.",tramadol,severe abdominal pain yet to be diagnosed,negative,427,435
78,"Getting to sleep is easy as is staying asleep. When waking during the night, returning to sleep was not a problem. The drug did not cause sleep so deep that waking and being coherent was difficult. Using Lunesta gives a sleep session of as much as 10 hours which might be a problem for some people. The drug is taken on an as needed basis. It has been used as much as three nights in succession without any noticeable ill effects.",lunesta,poor sleep with frequent wakefulness,neutral,204,211
79,"Did not notice much difference in decrease of rosacea bumps or redness but the bumps seemed to increase briefly after I got off the Oracea. For approximately one week after discontinuing use. I used in conjunction with topical Finacea, which I applied twice a day, also prescribed for rosacea. None noticed though per the treatment details (see below) it was often difficult to take based on your eating schedule. Take one pill a day. Must take one hour befor eating or two hours after with plenty of water. Also need to avoid sunlight while on this product though that is a good recommendation for skincare regardless of medication.",oracea,rosacea,positive,132,138
80,"When I have flareups of pain, taking the meloxicam with the cyclobenzoprine and a good nights sleep would leave me pain free in the morning. Extremely lethargic the entire next day, even if I took the meloxicam by itself I am supposed to take the tablet once a day, however due to how tired I get for the entire next day, I only take as needed. I did not figure out the problem with this drug until my son had to take it for something and he was totally wiped out as well. So, I really try to use as little as possible, even though I have a permanent prescription for it.",mobic,anti inflamatory,positive,-1,-1
81,"I am able to get good restful sleep and that is so important in my pain management. Sever tiredness, not able to leave the house after taking the medicine. Pain management, I take one to two pills a day as needed.",flexeril,muscle spasms,neutral,-1,-1
82,"I was able to turn my thoughts off at night memory loose, I am dependent on the drug and look forward to when I can take it. I not only experience memory loose @ the time of the dose but have also noticed were I cannot recall a week of activities. a 12.5 mg pill a night",ambien-cr,insomnia,positive,-1,-1
83,"relief of pain agitation, insomnia This drug was prescribed for pain caused by therapy for frozen shoulder. The pain was making it impossible to sleep at night, so the doctor prescribed tramadol. While the drug did moderate the pain, it also caused agitation, anxiety, insomnia. I stopped taking it after a few days. I also stopped the therapy. The pain went away and my shoulder improved on its own.",tramadol,shoulder pain,negative,186,194
84,"reactions over-road the benefits. I will simply say that I did not think I received benefits from this particular drug. There are other pain inhibitors that worked as well as the vicodin with out the druggy feelings and sickness. headaches, nausea, druggy feelings, heaviness, just an overall sense of malaise. Felt like I was in a drug induced stupor. Very uncomfortable and unacceptable. to control pain after surgery",vicodin,"nausea, headaches, dizziness",negative,179,186
85,"Was supposed to wait 10 days before attempting to quit 100%. The urge to smoke lessened significantly from first day. Went from smoking 15-20 cigarettes a day to about 5-10 the first day. By the end of the first week a was smoking 1 or 2 a day. Quit before the 10 days were up. 1.5 years later, I am still not smoking. Very irritable and angry. Fell into a depression. Within the first week I was very irritable but that is to be expected. I've quit for a couple of months before and this happened, too. However, I completely changed. I could not control my temper, I got very depressed. I didnt realize what was happening other than I just felt ""bitchy"". After 3 weeks I quit using the drug from 2/day to 1/day for a few days then quit. Total I used it for about a month. I went into a severe depression in which I was either very angry, very sad or just felt numb. I cycled between those feelings. Nothing brought me pleasure, the things that used to love to do like dancing or going out with friends, did nothing for me. I didn't care to do them. I thought I was going crazy. I was like this for about 4 months before I started feeling a little better and maybe about 6-7 months before I felt like myself again. I still get occasional cravings but the thought of going through that again keeps me away. I consider it to be effective but would recommend joining a support group or going to a counselor to help cope with the mood swings. If you don't have someone you see on a daily basis that can point out those changes I would highly recommend the latter. I didn't realize that i had fallen into a depression until months into it.",chantix,smoking cessation,positive,-1,-1
86,"It is difficult to discern if there were any real treatment benefits. Our son was given Prevacid after being diagnosed with eosinophilic esophagitis in an attempt to stop frequent bouts of mid-night stomach pain. It is possible the Prevacid had a mild-moderate impact on his stomach pain but more than likely it was the concurrent dietary modification. There were no long-term side effects. The first several evenings his stomach pain seemed to increase so the frequency was reduce to twice daily for the first 2 weeks. Treatment consisted of Prevacid (1.25 mg) three times a day and at this time the duration is indefinite. Concurrently his diet was modified, removing wheat, peanuts, dairy and beef, based on a blood based allergy test. The next phase of evaluation will include a measured DTH response to the identified allergens.",prevacid,eosinophilic esophagitis,positive,88,96
87,"after one year of taking this drug pregnancy was acheived via IVF and successfully carried to term with help of blood thinner heparin the side effects included mood swings, stomach upsets, head aches i was treated for secondary infertility, after evaluation doctor suggested insulin resistance and put me on metformin. while on metformin my perids become 28 days appart.",metformin,infertility,neutral,308,317
88,"The Femring is great because you insert it and don't have to worry about remembering to take a pill or pills every day. This allows you freedom for the next three months, (90) days until your reorder a new ring. Also my insurance pays a good portion of the cost of the ring, whereas it did not cover the cost of bio-identical horomone treatments. The bad thing about this certain dosage of the Femring was on the third day it seemed as though I was beginning to have vaginal irritation. The fourth day was obvious vaginal irritation with a blistery rash. Upon feeling and seeing this rash I removed the Femring and called my Dr. A lower dose Femring was prescribed, 0.05mg/day, which does a good job of returning my horomones levels to close to normal.",femring,hysterectomy,negative,4,11
89,"overall more at ease mantally was the only true benefit I felt. I was sweating all the time, also loss of appetite and sex drive. Uncomfortable in my skin. Constipation. Horrible to stop taking. Very hard to lessen the dosage and not feel like I was shaking out of my skin. Very edgy, trembles. I was being treated for adult rheumatic fever with antibiotics and steroids and paxil. I had a very hard time coming off of the paxil and I was very uncomfortable on it. The mental benefit was not worth the physical detriment.",paxil,depression,negative,375,380
90,"According to my psychiatrist and to what I had read, lamictal could be very helpful for people with PTSD. I had tried dozens of meds over the years and, at the time, was totally crippled with anxiety despite being on all the other meds. listed above. Hours after starting Lamictal I was given relief and the anxiety and dissociative symptoms reduced markedly. None that I noticed I was on 25 mg for a week or perhaps two, then raised the dose to 50 mg. I have been on this dose for many years now, along with the rest of the meds I take to manage symptoms.",lamictal,ptsd,neutral,53,61
91,"Reduced inner eye pressure which has slowed or possibly eliminated the disease. At the very least, the symptoms of glucoma immediately improved to normal and have remained at the normal range. Longer eye lashes, darker eyes, slight eye irritation. I have been very satisfied with the results of taking lumigan. My eye pressure was in the mid 20's and has dropped to the mid teen's. As an experiment, I stopped taking lumigan for several months and my pressure went back up over 20, so I went back on lumigan and it again dropped to the mid teen's. The preferred range of eye pressure is 10 to 20, with 15 or below considered to be optimal.",lumigan,glucoma,neutral,302,309
92,"There were none at all. There were many side effects such as mild hallucinations, major heart palpitations, and increased anxiety. I took Paxil for 2 weeks and after experiencing the horrible side effects I decided to tell my doctor that I wanted to stop taking it. My first 2 - 3 days were fine, until the dose was increased. Overall, this drug had to many negative side effects to be effective.",paxil,ocd,negative,138,143
93,"Prior to using this spray, I had year round nasal problems: unable to breathe out of one or both nostrils. The symptoms were particularly bad during the summer, and whenever I was in a laying down position. The symptoms greatly interfered with my sleep. When using this spray on a regular basis, my nostrils are completely clear most of the time, and I have minimal nasal problems during my allergy season. nan I believe the recommended dose is two sprays per nostril twice a day. I found that a ""maintenance"" level of only one spray per nostril each day on works for me.",nasarel,rhinitis,neutral,-1,-1
94,"After taking the Zyban for 3 weeks my desire to smoke was nearly eliminated. I had tried other methods to quit smoking and this one actually worked! Unfortunately I had a severe allergic reactions to the medication (the main ingredient Wellbutrin). I initially broke out in hives which became so severe I was taken off the Zyban and prescribed a steroid. The allergic reaction internalized and I ended up missing 3 weeks of work do the joint immobility it caused. I was impressed with the ability the medication had with my decreased desire to want to smoke, but the side affects/allergic reaction was to severe to continue using it.",zyban,to quit smoking,negative,17,22
95,"Cleared up the infection but any number of other drugs would have done just as well, without the awful side effects. Cipro can have a devastating effect on connective tissue. In my case, loss of elasticity, leading to wrinkled, drying, aging skin on face, neck, hands; suddenly visible veins; heightened sun sensitivity; easy bruising; weakened, painful knee and ankle joints, insomnia. I subsequently discovered that these are all too common ""rare"" side effects, among many others, and none of them emerged until a few days after finishing the dose. Unless you have no other options, this is a medication to be avoided. I subsequently discovered that I was prescribed this drug for a condition that any number of other drugs would have cleared up just as as easily and was given way too much of it as well. The whole experience has been a nightmare. Nearly a year later, still suffering after-effects. Do not take this drug without checking it out. Cipro was black-boxed by the FDA less than a week after I finished my prescription, and MDs still hand it out like candy.",cipro,puncture wound,negative,117,122
96,"The application of estrace relieved vaginal dryness virtually overnight. It also caused reduction of pain during intercourse. Improved sex drive and response. The application of estrace didn't appear to have side effects initially, however, upon continued use severe irritation of the vaginal lining occurred as well as a severe yeast infection. Yeast infection was so severe it required prescription medication to clear up. Estrace was applied vaginally 3x weekly.",estrace,hysterectomy/menopause,positive,19,26
97,"None. It didn't help me sleep. I was cranky the next day, depressed, and tired. I took it for 2 days. The third day I didn't take it. Which was tonight. I keep waking up because my subconsious is terrified of something. I keep hearing things in my sleep. I am terrified to go back to sleep. My heart is pounding from the horrible things I keep hearing in my sleep. I never had this until taking this medication. I think I may miss a day of work tomorrow from not being able to sleep. I wish someone was here with me so I wouldn't be so afraid to go back to sleep but the sounds I keep hearing are so terrifying. My doctor gave me some samples for insomnia.",ambien-cr,insomnia,negative,-1,-1
98,"Wasn't as severly depressed as before taking the drug, didn't sleep as much and was able to function normally in a job. nightmares, some drowsiness during the day, minor weight gain Took the medication in the mornings tried to discontinue the medication gradually, but had severe side effects including electric like shocks",effexor-xr,depression,positive,-1,-1
99,"I did not have to go through the change of life so early in my life, never really felt any change, at the time it was the best way to remove all the endrometriosis that i had, and it never effected me much as in pain or my womenhood. I had no side effects, other than a little soreness after the operation, nothing went wrong, and my sex life actually improved, mainly because there was no more pain down there. after the operation i relaxed for three weeks no heavy lifting, took premarin, still take premarin, so at the age of 47 still have not had the side effects of menopause, which is nice, they say there are risk at a later age and how long you've been on them, but am confident enough and quite healthy at this time.",premarin,hysterectomy,neutral,481,489
100,"This medication helped me marginally to focus better and was somewhat more energetic. I did not had much side effects, had some dry mouth at times but was manageable. I started with low dose with 5 mg dialy, gradually increased upto 20 mg. Did not hv satisfactory results but my psychiatrist did not feel comfortable to increase the dose due to serious drug abuse potential though I absolutely hv never tried as illicit drugs including the most commonly used MJ and alcohol.",adderall,adha,positive,-1,-1
101,"diclofinac has helped with the pain and swelling of joints.Lefluonomide, for me, had no noticible benefits. Nausea, weakness leg and feet cranps shortness of breath rapid heart rate. After a short time I discontinued the medicine, symptoms held on for three more days, Still not feeling well but there has been mild improvement see side effects",arava,ra and ankylizing spondolitis,negative,-1,-1
102,"Catapres was initially effective at reducing my blood pressure on it's own, but there was reduced effectiveness over time. For this reason I began taking Betaloc in addition to catapres (daily). Taking these two drugs together has resulted in good blood pressure control with a fairly low dose of each drug. A side benefit of taking catapres has been that it helps to control my Rosacea symptoms. I have had the reason for this explained to me, but cannot recal the details (has something to do with Catapres effect on the sympathetic nervous system). I experience slight sedation after taking Catapres which is helpful for me as a light sleeper. I believe I experience some slight lethargy that is ongoing, but not troublesome. When I first started taking Catapres I got a very dry mouth, but this quickly went away. I have experienced no other side effects that I am aware of. I'm not sure what this question means, and may have already answered it. I am taking Catapres and Betaloc for longstanding essential hypertension. I have noticed that when I take these two drugs together their individual effectiveness is amplified. I have been cautioned by my doctor that it is important not to suddenly stop taking this drug combination as this could cause a heart attack.",catapres,high blood pressure,neutral,0,8
103,"Prevented a recurrence of the leg and lung clots during the period of therapy and helped the body stabilize long enough to repair and/or work around the damaged areas, eventually resulting in elimination of pain and swelling. Minor bruising and longer bleeding times with cuts, but nothing serious. Occasional dizziness when the INR counts went above 3 or 4. It's difficult at times to get a stable INR reading due to all the various foods, supplements, and drugs which either increase or decrease Coumadin's effects. Prescribed Coumadin after DVT and PE stay (with IV heparin first) for six months. Weekly blood tests until INR levels stabilized, then biweekly. One 5 mg pill taken daily with warnings to watch food, drug and supplement intake.",coumadin,blood clots,positive,498,506
104,"I gave up smoking fo four months after taking Zyban for 10 weeks Zyban made me not care about smoking, it also made me not care about anything else, not exactly depressed - just nothing seemed worthwhle. I took Zyban for 10 days before my quit day, then quit smoking and continued with the Zyban for a further 8 weeks. During that time I smoked on three or four occasions, mostly part of my husband's cigarette. I was really pleased with how I had done, and thought I had finally managed to kick the habit. But on holiday with a lot of smokers I gave in and smoked, thinking I would stop again when I got home - unfortunately that didn't happen.",zyban,smoking,neutral,46,51
