id,text,aspect,category,polarity,from,to
0,"The treatment benefits were huge - all hot flashes stopped within 1 week, skin dryness subsided, irritability was greatly reduced and energy levels are much higher. No seen side effects at this time, although I do worry about the side effects on the liver and long term use with breast cancer increases. Post surgical hysterectomy, started into immediate menopause with all above symptoms, felt drained, tired, hot flashes. Was put on 1mg estrace once a day. The doctor says I will be on for approx. 10 years.",estrace,surgical menopause,neutral,439,446
1,"NONE!!! EXTREME fatique. I was not able to function day to day activities. I spent 14-18 hours a day in bed. My muscles, joints & bones ached. The depression was not relieved, which probably a result of the side effects. I came off the drug slowly ( with help of physician) and now I feel great. The depression is still a possibility but I will NEVER take an anti-depression drug again. I choose to have therapy and ask for the support of my family & friends Slowly declined dosage and am NOW EFFEXOR XR FREE!!!!!!!",effexor-xr,depression,negative,-1,-1
2,"None... did not make my periods any lighter Weight gain... I gained 10-15 pounds while on the pill and because I'm only 4'10, that 10-15 pounds REALLY SHOWS. I've tried other oral contraceptives for my heavy menstrual bleeding and all of them do the same thing... they don't help regulate my menstrual bleeding but they do make me gain weight. In the future, when I need to use a method of birth control, I will not be using oral contraceptives... EVER! My sister is also on this pill (for birth control) and she has experienced many side affects from it, too.",ortho-tri-cyclen-lo,heavy menstrual bleeding,negative,-1,-1
3,A non return of breast cancer night sweats polyps in the womb brought about the menopause weight gain I had a mastectomy and radio therapy followed by 6 months of chemotherapy and then tamoxifen. Weight gain and ceasing mensturation may have been caused byt he combined effects of the chemotherapyt and tamoxifen. Given I had 3 polyps removed it was decided to cease tamoxifen in the 5th year.,soltamox,breast cancer,positive,-1,-1
4,"I had no treatment benefits. Did not stop the sweating, but I started bleeding vaginally quite heavy. I hadn't had a period in 6 years. Then this happened. I also had some mild cramping like you get when your period is going to start. Bright red blood, some clotting as well. Went off of of prempro after 33 days. I am still bleeding but I have been told that this will stop now that I have stopped prempro........also I suggest you look online and get informed about the severe side effects........my doctor in the end stated that she would never take them........would have been nice if she told me this before I did and when she prescribed them for me. all is said above treated for heavy hot flashes and night sweats",prempro,severe hot flashes and night sweats,negative,291,298
5,"I was told to avoid coffee, tea, chocolate & peppermint :'( My hiatal hernia is tiny, but I feel fortunate that I was told about it before it got out of hand. I feel 100% better 90% of the time, and when I don't, it's usually because I forgot to take my pill the previous day. I would prefer for my pain to be treated by diet changes alone, but it's nice to have a pill to rely on. It's my goal to control my pain naturally, wish me luck! nan One a day before the largest meal of my day, normally dinner. Antibiotics for my Ileocecal Valve problem.",protonix,hiatal hernia and ileocecal valve syndrome,neutral,-1,-1
6,"nan Bleeding not even Spotting Ladies: I am sure you may have done lots of researches by now regarding taking Seasonique (PLEASE do before you try to take this drug), and there are lots of negative than positive comments on this drug. I would like to point out a couple of my comments to share with you. I normally have 4 - 5 days menstrual periods every month. But I was not happy and tried to be on this drug because it described 4 periods only per year (WOW! what a great idea, especially I have small child, school, work, and husband). Guess what happen since then? I have been bleeding almost 2 weeks now, and from light to heavy, the worst part is I get all these uncomfortable cramps, keep waking up at night, my personalities change from good to bad, I have not been in a good mood since then. of course not, how can I be in a good mood when my vagina keeps bleeding on me every single day (I am sure no woman likes that), and so on. I spoke with my OB, and she said it's normal. I don't think so, it is completely not normal to me. I have been bleeding, and ruin my daily life style. No wonder it is called Birth Control. How can you have sex with your partner while you have all these symtomps in your body especially bleeding? I stop this drug, and can't wait to have my clean dates back. Ladies: I am not saying all the women's body are the same. But if you want to be on this drug. I would advise you do more researches and read more comments before trying, and other advise is if you think it's a good idea for 4 periods per year, you may want to think twice. Because it's a mother nature for women that has 13 menstrual periods every year, trying to change it and playing with your hormones are the game, unless you like to gamble, then you may want to try this excitment drug, and hope you will win. Otherwise, please consider something else. I am so regret that I did not read all the comments and reviews before I asked my OB to put me on this drug. Therefore, I have to suffer what I deserve (I guess). I just don't want to see another woman to be suffered like me, as I finally found out there are lots of women out there are taking the same drug (before I made up my mind to throw this drug away) that are suffering the same symtomps but still want to continue and hopefully that will work one day. For me, ""no is no"". You can call me chicken or looser or whatsoever. But let me tell you, it is defintely not fun if the drug makes your life changes from okay to worse! Final words...... Good luck if you are on this prescription, and I hope you win, if not, you defintely need these words ""Good Luck""! :)",seasonique,have not stop bleeding,negative,110,120
7,"very firm erection around 20 minutes after initial dose. The 100 mg dose was considerably more efficacious than lower doses. The ""firmness"" of the erection is much more notable at 100 mg. Terrible headache and flushing of chest and face. The flushing of the chest and missive headaches happen every time, without exception. have had ED for most of adult life despite not knowing the etiology.",viagra,erectile dysfunction,neutral,-1,-1
8,"completely ended panic attacks,most sweating,most blushing,much discomfort. more anxiety at first for about 3 weeks. some headaches,nausea I started the medicine 8-10 years ago and took the medicine religously to begin with. Took about 4 weeks to really make a difference. However, did notice change after only a couple weeks. I slack off many times and after a day or two of missed pills I notice dizziness and mild headache plus some nausea. Not good to do, but it happens. After being on the medicine as many years as I have, I don't think it is as effective as others may be, but I have tried many...Prozac,Zoloft and numerous others I don't remember the name of and nothing worked as well for me as Paxil..Another note is that anxiety runs in my family and a few aunts and uncles in my family have had the same good luck with Paxil. I often wonder since we are related if it treats something in our brain the same as it seems to work for this family??? Something to think about if you know someone else in your family that suffers from depression or other mental illness.",paxil-cr,anxiety,neutral,-1,-1
9,"Increased productivity, ability to stay awake during the day. Dry lips & mouth. Teeth grinding. Tough time sleeping. Highly addictive. This was used in conjunction with Lexapro for depression. I started taking it to keep myself awake (drowsiness as a side effect of the LExapro). However I quickly lost about 10 lbs and couldn't stop moving around. Eventually my thinking became jumbled (I don't have ADD). I was constantly thinking in circles.",adderall,depression,positive,-1,-1
10,"There were no treatment benefits from this particular drug. My nausea was not controlled at all, in fact I felt more nauseaus after taking the medication. I had severe restlessness, developed an intense feeling of anxiety, had an extreme desire to sit down, then lay down and went on to develop a dystonic reaction. I developed an intense feeling of doom, my stomach had feelings of cramps, knotting and pain. My neck felt tense and the ambulance was called and I was taken to the emergency dept of local hospital. Ambulance officers gave me pain relief and this settled my stomach of the knotting and cramping/pain. This also settled the feeling of doom. In emergency, after numerous examinations and questionning, abdo xray, I was given IV hydration x 2 litres and Ondansetron IV x 2 - 8 hours apart. I was observed in emergency overnight and went home the next morning with no side effects at all. Never will I take maxalon again!",metoclopramide,nausea,negative,-1,-1
11,"nothing....I think I am getting worse! I dont know what else to write, I just dont get better!..I am so dissappointed, I feel my eyes tired and dry easily, I get tired so fast and my lips are dry the whole day! upset stomach, nausea, fever twice a day DOXI 100 mg...plus face creams.. I wash my face carefully everyday, I exercise (jogging) but it is the same and even worse, my face gets red and have several bumps in my whole chics...hate it! :(",doxycycline,acne rosacea,negative,-1,-1
12,"Reduced the pain. no noticeable side effects. Started taking right after surgery. I had to subsequent surgeries during the following 5 months. Was taking in conjunction with narcotics right after surgery and for a week or so, then only the Celebrex. After about one year, it was reduced down to once a day. I noticed if I didn't take the medication my shoulder would consistantly ache at about a 3-4 out of 10 pain scale. With the medication, I would rate the pain as 0-1, not really noticeable, but still there.",celebrex,post shoulder surgery pain,neutral,240,248
13,None due to the short time taking drug. Headache first morning at 4AM that was relieved with Excedrin. Migraine headache with vomiting that lasted 14 hours. Couldn't go to work that day and stopped taking it. Not much to tell. I was just starting treatment with Klonopin and Abilify with the goal of stopping Klonopin in 30 days and then seeing how Abilify was working.,abilify,bipolar,negative,275,282
14,"Improved exercise tolerance. Stopped coughing up blood. Improvement in chest pain. Nausea, bad dreams, very prone to sunburn. For the antibiotic to be effective I need to take a relatively large dose for my size (50kgs). Have to take anti-nausea medication while on the course of antibiotic otherwise tend to lose weight. Have had repeated courses of this antibiotic over several years. Sometimes it works and other times it doesn't but the infection always recurs within a few weeks of stopping the treatment.",proquin-xr,recurrent pseudomonas chest infection,positive,-1,-1
15,"there were no treatment benefits in taking this drug i broke out into hives all over my torso i was seen in the doctor's office for a swollen lymph node in my groin. at first i was told to use warm compresses; this didn't work, so they put me on an antibiotic (keflex) and within 2 days i had broken out into hives all over my torso, and the lymph node did not decrease at all in size. it was still red, swollen, and painful. i then heard about lymph drainage, done by a certified massage therapist. went for one session. by the end of the session, my lymph node was smaller, no longer red, and no longer painful; within a day after the session, the lymph node was no longer swollen.",keflex,infected lymph node,negative,261,267
16,"I did not experience any treatment benefits from Topamax for my severe and incapacitating migraines. I did not get relief for my migraine headaches. My migraine headaches did not stop. My migraine headaches did not decrease in duration(3 days per migraine) or intensity (severe). I had one - 3 day a week migraine for over seven years. The Topamax treatment side effects were extreme when I was taking it. I experienced extreme weight loss, I went from one hundred thirty pounds down to ninety eight pounds. I experienced mental confusion and had a hard time focusing on anything including family, relationships and work. I experienced a deep depression and had suicidal ideations that I had never before had. I also experienced loss of my word finding skills. The treatment details for Topamax which is used to treat seizure disorders was also supposed to treat migraines are as follows. As the patient I was to take fifty milligrams per day and was told I would lose perhaps two percent of my body weight but that after a thirty day period my migraines would decrease in intensity and decrease in duration.",topamax,migraines,negative,49,56
17,"cleared acne, dried skin out considerably. Was very easy to use. Did not take much to use. No smell or fragrance. created such redness and irratation my face looked worse from that then it did from the acne. Created cracks around my eye area that was very sensitive. My skin burned and stung. Skin became so dry it itched. I was embarrased by the redness and flaking. It almost looked like my skin was burned apply nightly to clean skin",differin,acne,neutral,-1,-1
18,"In the beginning of my treatment for type 2 diabetes, I found the benefits of Glucophage or metformin for me to be two-fold. Number one, metformin did seem to lower my blood sugar over a short amount of time in the beginning. Number two, as a medication I found necessary in my life, I have found it fairly inexpensive to purchase as a generic drug. The treatment side effects I experienced were in the beginning. At the very start of taking Glucophage, I had diarrhea. It did go away after some time on the drug. I take 1000 mg caplets; one in the morning with my breakfast and one in the evening with my dinner.",metformin,type 2 diabetes,neutral,92,101
19,"While I definitely did notice some improvement in my depression, I believe that Zoloft is far from being a truly effective antidepressant drug. My depression had somewhat subsided and my panic attacks were less severe, albeit not completely gone. From my personal experience, this drug exerts its effects mainly through a total numbing of one`s emotions. I had become a zombie, not feeling depressed but at the same time not feeling any positive emotions. My emotions had been totally flattened. My libido was gone. I had absolutely no desire for any kind of sexual activity. 50 mg per day, in the mornings. Total duration of the treatment: 3 years. During the treatment course, attempts were made to titrate the dosage to 100 mg per day, but I couldn`t tolerate it.",zoloft,depression,positive,80,86
20,"After menopause, I experienced painful intercourse and some bleeding caused by vaginal dryness. I tried over-the-counter lubricants including suppositories but found them to be inconsistent and they also masked sensitivity in the vaginity area. Vagifem has little side effects. I occasionally notice some discharge. I also feel bloated for a day or so after inserting. The small tablet is inserted vaginally twice a week. It's recommended that you do so at the same time of day. Twice a week is somewhat difficult to keep track of. Does that mean every 3 days or every 4 days? It involves marking treatment down on a calendar to maintain a regular schedule.",vagifem,vaginal dryness,neutral,245,252
21,"While taking Effexor at the 37.5mg dose, I have noticed some improvement in my mood stability throughout the morning. I felt less anxious during the day, but anxiety creeps in again towards the night. Although I felt MUCH happier and more like my ""old"" self on the higher dose, the 37.5mg dose allowed me to sleep the night, which was not possible at the higher dose. Upset stomach was common if I forgot to take it with food. My doctor prescribed due to depression and anxiety. As mentioned above, I felt so much better on the higher dose (75mg?)... but was unable to sleep at night for several weeks on this dose. Therefore, I began again at the lower (37.5mg) dose (after trying a few other antidrepressants). Overall, I am currently unhappy with the effects of the lower dose.",effexor,depression,positive,13,20
22,cleared my UI i didnt even know i had one.. feeling sick dizzy made vision in eye go funny. made tendons in whole body swell made muscels feel like they are burning. i cant excercise now because i have to let me tentons heal . i dont know how long it will take. brain fog extream fear and emotional . please dont ever take this medication im horrified by how it made me feel in such a short amout of time,proquin-xr,u/i,negative,-1,-1
23,"Mirapex: tremor control Mirapex: impulse control absence, induction of OCD symptoms, drug addiction (heroin, crack, etc.) and hepatitis B & C all pursuant to massive sexual and substance risk taking behaviors, loss of professional license, theft of $1million of clients' funds, gambled EVERYTHING away, lost everything, began inappropriate sexual relationships with prostitutes in home town and in Central America as well as with underaged females (who were often teenaged crack addicts), theft of EVERY SINGLE ITEM of any value from his extremely elderly wealthy father and from the rest of us, left crack in our young adult daughter's car, severing of relationships: WE have to protect ourselves from him and his evil-Mirapex reactions Subsequently: he got DBS implanted and has been able to reduce the Mirapex - BUT THE DAMAGE IS DONE",mirapex,parkinson's,negative,0,7
24,"I sometimes wake up refreshed although with xyrem I only sleep for about 5 hrs every night Night sweats. waking up too early. Getting unrefreshed sleep every other night I have been taking Xyrem for about 2 months. I sleep about 5 to 5 1/2 hours every night. I wake up between 3 to 3 1/2 hour after the 1st dose and then I sleep for about 2 to 2 1/2 hours after the 2nd dose and am unable to fall asleep. The weirdest thing is that I get a refreshing sleep every other day. On the days that I wake up exhausted, I am barely able to make it through the day and am hungry all the time. The next night, I usually sleep well and have a better day there after. I am going to stop taking it and I am going to explore other options such as Rozerem or Trazodone",xyrem,"unrestful sleep, narcolepsy?",negative,44,49
25,"As an RN for 14 years, I was familiar with Detrol LA and why it was prescribed for me. I was diagnosed two years ago with Multiple Sclerosis and have a spastic bladder. Soon after being prescribed Detrol LA, I had a definite decrease in urination frequency. However, after about six months, my urinary habits returned to pre-medication levels. I void every two hours. About one year ago, I stopped taking Detrol LA for two months, thinking that giving my bladder a break from the med would help. I then restarted Detrol LA and noticed no difference. I am seriously thinking about stopping the medication. It is essentially useless. Mild dry mouth. Otherwise, no side effects. I have been on Detrol LA for since being diagnosed with Multiple Sclerosis two years ago. I have a spastic bladder and urinate every two hours. I take 2mg twice a day. The medicine worked for about six months, then was virtually ineffective.",detrol-la,spasdic bladder,positive,-1,-1
26,"Risperdal reduces worry about visual and auditory hallucinations that remain. Personality remains intact. Disturbing thoughts are reduced. Significant weight gain, weak muscles, fogginess, nightmares, sleepwalking and loss of appreciation for humor. She sees people and hears music that others do not see or hear, therefore takes risperdal when symptoms are too difficult to manage to be a competent spouse, parent and professional. Talk therapy combined with medication monitoring supported by Risperdal each night helped to improve self confidence and reduce paranoia.",risperdal-consta,hallucinations,positive,-1,-1
27,"Breathing became easier. Had leg cramps, dizzyness, muscle weakness, tiredness - progressive over two months of taking Symbicort. The patient died two months after commencing Symbicort. Discussion after death led to physician suggesting this was the cause of a massive MI and death. He was going to report this to the manufacturers. On using second issue of Symbicort death occured.",symbicort,asthma,negative,119,128
28,"It mostly eliminated the urge to smoke, allowing me to quit. Having tried other drugs to quit smoking, I was shocked by how effective this drug was. Severe depression, suicidal, that continued for eight months until I decided to start smoking again. Drug made my kidneys ache. My daughter had similar depression/suicidal side effects. In my opinion a dangerous drug. I followed the recommended drug regime, until I reached a dose of 1 mg a day. I did not feel the need to increase dosage beyond that, as I stopped smoking, and was having side effects of nausea, stomach cramps, kidney pain, as well as mood changes, which I had anticipated, and thought were normal.",chantix,tobacco addiction,negative,-1,-1
29,"better mental acumen, energy,hair texture,better physical endurance and strength I would not term the effects as negative side effects, nor would I say they the effects were as beneficial as I expected them to be. 10 years later and I am still suffering the same symptoms, though not as severe. I have had a very difficult time getting traditional Dr.s to look beyond the Thyroid and to realize that for a woman it becomes a package deal. Once you hit menopause and the chemical balance shifts it is not enough to look at one part of the body and blame that for all your symptoms. I was NEVER sick as a child or young adult. I never had female problems, but once menopause set in my body went haywire. I KNOW, in speaking with women my own age,that I am not an isolated case. Thyroid disease is more prevalent than ever and this drug does not cut it for some patients. One pill every morning 1 hour before breakfast. Just recently instructions have included not taking vitamins with Calcium 2 hrs after the pill, but this has not made a difference.",synthroid,hypothyroid,neutral,-1,-1
30,"After the administration of the first injection the pain decreased, however after a period of two weeks it returned. A second injection was administered. There was no improvement and undesirable side effects, as described below, appeared. Two days after the 2nd injection the body weight started to increase. In the forth day it was 1.5 kg heigher. In the following four days it returned to almost normal. During this period I felt tired and dizzy and fainted at one occasion. The blood test indicated that the concentrations of potassium and sodium were outside the normal limits (Potassium too high, 5.3 mmol/L and sodium too low, 134 mmol/L), in a dangerous range. Similarly to the pH, the safe range for these two ions is narrow. Four days later the potassium was OK, 5.1 mmol/L albeit high, but the sodium, remained unchanged. In additional three days, the sodium was OK,136 mmol/L ,albeit low. I continued to feel tired for the next two weeks Two injections were administered in a period of two weeks",betamethasone,trochanteric bursitis,negative,-1,-1
31,"For awhile it did prevent cold sores. Then I started having frequent chest pains as well as fainting spells. Now I'm finding out from an ER Physician and the Pharmacist I 1. should never have been prescribed this dosage (twice what should be prescribed in per day) and NO-ONE should take Acyclovir for this length of time either. I've been told this is the reason for my fainting spells, chest pain, low blood pressure problems, increased kidney (renal) damage, yeast infections and most recently a series of fungal infections. fainting spells, chest pain, low blood pressure, further kidney damage, infections followed up with fungal infections. I now am taking 1000 mg of L-Lysiene (natural food store or grocery store) per day. It's extrememly low cost and it's very effective. I hope this information will help someone not go through what I've gone through. I don't have chest pain since I've quit using it after one week. I was never even given one liver functioning test on this at all and that is reccommended by the way. Good Luck and take care.",zovirax,cold sores/ herpes i,positive,-1,-1
32,"Reduces the symptoms of pseudomonas chest infection for a few weeks, especially the haemoptysis. Condiderable nausea, bad dreams & increased sensitivity to the sun. Take the drug for a 3 week course then wait until symtoms increase again then have another 3 week course. Usually works out at about 3 weeks on & 3 to 4 weeks off.",proquin-xr,chest infections,positive,-1,-1
33,improve cystic acne on chin -- I still get a few bumps but not as many or as violent as before the treatment. perhaps a little dryness but I cannot say that this was a problem at all. I have tried many prescription and nonprescription medications for adult acne. This one worked as well as any of them with less irritation. While I was using the medication to treat cystic acne I also saw a significant improvement is white heads and black heads. White heads on my forehead virtually disappeared.,aczone,acne,neutral,-1,-1
34,cleared bacteria on skin slightly stomach pains sickness tetracycline is a antibiotic and a hormone used to control infections and regulate hormonal imbalances.,tetracycline,acne,positive,57,69
