id,text,aspect,category,polarity,from,to
260,"I didn't get malaria Prescribed to my Husband and I on our Honeymoon in Vietnam and Cambodia. On day 4 we both experienced waves of strong abdominal pain every hour or so accompanied by a need to go to the toilet with diarrhoea (but it was non-urgent need to go to the loo - like a normal upset tummy can be). Initially believing that it was a normal holiday tummy upset we starved ourselves for nearly 4 days (we were also not hungry) but the waves of pain did not significantly subside - triggered by drinking water. We then arrived at a Hotel in Vietnam that had Internet access and looked at some lonelyplanet blogs - the advice on Malarone was to make sure to follow the medication instruction leaflet to the letter i.e. to take it with a ""milky"" drink. We then began to take it at breakfast with as many dairy products as we could - yoghurt, cheese, milk on cereal etc, and the symptoms subsided. The pain ceased after a couple of days but we continued to have violent, liquid bowel movements for another week... It would help if the leaflet explained why dairy is recommended - is it the fat that is required or the alkaline environment?",malarone,anti malarial,positive,636,644
261,The drug reduced the frequency of acid reflux events and the associated pain After a few days I experienced severe muscle ache in legs such that I had difficulty climbing stairs. I also had overwhelming fatigue and even indigestion This drug was fairly effective after one week's use week but did not cure the reflux completely and the side effects were very debilitating. I experienced a rebound effect after stopping which lasted for approximately four weeks. After having an endoscopy I was diagnosed with gastritis.,zegerid,acid reflux,negative,-1,-1
262,"A little better than nothing. None - it didn't really work. Always left gasping, although not as bad, never clears up the beginning of an attack. Had to go to Drs. office for a treatment and steroid pack. Requested another named inhaler. Got Pro-Air... Currently looking online to Canada to try and find the original Albuteral inhaler. With all of the factories, truck engines and exhaust, hairsprays, how much actual damage does an inhaler do, comparitively speaking???",albuterol,chronic bronch/asthma,negative,-1,-1
263,"First days after surgery were a blur. There was considerable swelling post surgery, and the drug helped me to ignore the way I looked. I was awake but sort of in a daze. I had plans to do research and reading during my recuperation, but I don't remember doing much of anything for about 5 days. Post laser surgery. I had Fraxel Re:pair laser done. I quit the drug as soon as somebody told me I looked like a Zombie.",xanax,anxiety,positive,-1,-1
264,prevent further clots and to dissolve pulmonary embolism blood clotting times would vary tremendously and required frequent testing to determine dosage adjustments. Sometimes clotting times would need to be checked weekly or more often. The diet was very restrictive. Too much vitamin K could lead to clots and too little could lead to spontaneous bleeding. Any medical procedure reqiured going off coumadin before hand and going on lovenox shots to the stomach for a week.,coumadin,blood clots,positive,399,407
265,"I took it when my husband of 30 years left me and my 4 kids for another woman. I couldn't sleep, eat or function. The klonopin helped me sleep, which helped me function. I probably would have committed suicide without it. I first noticed that I had trouble memorizing things. It was the trouble with equilibrium and balance that motivated me to get off of it. I got to the point where I was a little unsteady walking with flats. I also had morning grogginess, which would gradually get better by lunch time. It was hard weaning off because of the insomnia that insued. Once I got off my fibromyalgia got much better, the memory improved, and the disequilibrium slowly improved.",clonazepam,anxiety/insomnia/,positive,-1,-1
266,"The ointment is easy to apply once the user realizes that the ointment is very thick, although Protopic on the face is ineffective or must be prescribed only for those conditions it has proven to resolve. In my case, The rash continues to spread across the face. A thin layer proved to result in dramatic itchiness in those areas coated by Protopic ointment. Thin layer twice a day to be used as needed.I also made a deliberate effort to use the Protopic as directed appying it twice a day as directed.",protopic,undiagnosed,negative,95,103
267,"I started taking Tirosint 125mcg 6 weeks ago due to a gluten and caseine allergy. I previously was taking synthroid however, the company couldnt verify the inactive ingredients. So to avoid gluten, caseine, and some really nasty anxiety symptms I switched to the Tirosint. The anxiety symptoms subsided from 1 attack per day to none. This was great!, but then new symptoms started after three weeks. I felt dperessed, tired and very sore. My finger joints hurt so bad and to the touch. My back, and legs ached. Then my lower legs, ankles and feet started to swell. it is so bad that I cannot walk upon waking in the morning. If Im on my feet for more than an hour I have to elevate my legs due to the pain and swelling. I also gained alot of weight 8lbs. I'm a healthy 37 year old woman, I am active with two small boys, and eat an extremley healthy diet due to my Celiacs and Caseine allergies. I recently had my blood levels checked and to my surprise I was taking way too much Tirosint. My Endo said that the swelling and pain wasnt from the Tirosint and that I should see my Primary doctor...REALLY?? I was shocked due to my ""hypo"" symptoms. Im thinking of returning to Synthroid and switching doctors... 125 mcg Tirosint per day and doubled on Sat and Sun. Listen to your body and be persistent with your doctors.",tirosint,thyroid/total thyroidectomy due to cancer,positive,17,25
268,"helped lower blood sugar severe ankle swelling, stomach pain Took Metformin (2) times along with Actos. Lowered blood sugar somewhat, but the side effects were terrible. Cut dose back to just Metformin, dropped Actos completely. Along with diet change & excercise it has lowered blood sugar levels I would say 20%",glucophage,diabetes,neutral,-1,-1
269,"The drug was taken for my daily anxiety caused by stress and also insomnia to help relax my body before bed. The drug is mainly intended for anxiety and works great at relieving those systems such as irregular heart beat, nervousness and other anxiety causing symptoms. I give it a 9 out of 10 for its performance. The only thing i didnt like about this drug is that with taking it overtime I felt as if my body built tolerance to the drug as well as became more dependent on it. I still am until this day and have managed to ween off the drug. Then again every ones body is different, Just do your research before taking benzodiazepines long term. The treatment overall treated my anxiety quickly and effectively. No regrets. The drug overall has treated me effectively despite the minor drawbacks.",clonazepam,anxiety/ panic attacks/ insomnia,neutral,-1,-1
270,"I could not see any benefits. I certainly did not feel any more emotionally balanced or stable than before. This medication plunged me into experiencing menopausal symptoms. i took a blood test and my GP told me that I was not menopausal and gave me under arm deodorant which stung for the excessive sweating. My skin became extremely dry. I have no more natural vaginal secretions. My hair became very dry and I am experiencing small bald patch sin the front hair line.my sleeping pattern is absolutely awful. I look tired and haggard all the time, with enormous eye bags.The pain in my knees became a lot more severe I was prescribed this medication when the medication I had been taking for 2 and a half years became ineffective. I was not informed of any side effects. Every time I went to my GP to discuss symptoms which I was worried about, they just patronised me. I no longer take any medication for my condition and although I do not consider myself to be well, some of my symptoms have reduced. The others such as incontinence, dry skin, lack of natural seretions, I am just trying to live with or trying to find products which I hope will one day help me.",effexor-xr,clinical depression,negative,-1,-1
271,heal herpeses and prevent from breacing in the feature none Use every day if you have brake out and take at lease 1 pille a week to prevent from future break out.you can combine with zovirax cream and apply to the break out to heal out and take a pill to treat in.Zovirax is a great medication over the counter ....it is very efectivly and i hightly recomended.,zovirax,genital herpes,neutral,183,190
272,"Treatment for three conditions all in one drug. Stomach upset, sun sensitivity. I'm unlucky to have three conditions that affect the attractiveness of my face. I've struggled with acne since youth, and I've also had chronic blepharitis since age 12. I am not heading into my 30's, and I'm beginning to develop rosacea on my upper cheeks, which could be contributing to my blepharitis. Some days, I just don't feel like leaving the house because of how I look. Doxycycline has helped clear up the acne and the rosacea symtoms. However, it wasn't as affective at treating my blepharitis, so I'm not going to try a topical antibiotic, which has worked in the past.",doxycycline,acne,neutral,460,471
273,"none except....slowed heart rate. My afib was NOT diminished, but I assume the drug was helping keep my heart rate when in Afib down somewhat The 3 months i was on atenolol (25mg) I had vertigo, short term memory loss, anxiety, and hearing issue. All except hearing went away when I switched to a different beta blocker. Joe Hare once a day 25 mg",atenolol,atrial fibrillation,negative,164,172
274,Montelukast stopped the constant recession leading to repeated hospital admissions Aggressive behaviour - hitting me dad and herself badly Bad dreams Confusion Hallucination Irritability Restlessness Sleepwalking Tremors Trouble sleeping oral pain Stomach pain Diarrhea constantl tugging at ears4 No appetite Clammy these are all symptoms reported to her gp and consultant after 1 month of treatment to take Montelukast every day. to take clenil (inhaled) 2 puffs 2 times a day to take salbutamol - when needed,singulair,asthma - repeated chest infections,negative,-1,-1
275,"Early this year I started noticing my skin around the eye beginning to lose its firmness: wrinkles formed during sleep could not be smoothed out by using Lancome eye cream. Though, applying a collagen eye product does tighten up the eyelids, but only on the surface, and causing the skin around the eye to crack following facial motions. I was very self conscious about the wrinkles. After using Renova (I've been using it for about two month now), the wrinkles are smoothed, and where the skin easily wrinkles is firmed up, supple and elastic. For the initial two weeks, where I applied Renova caused a stinging sensation and a mild redness. My eyes were watery for a few weeks as well. Also, for that initial few weeks, the skin looked dry and the wrinkles looked worsened in that one-hour ""drug-work"" duration for which I didn't put on any moisturizer. All the symptoms are gone now, and the skin is denser and firmer and I no longer fear people looking at my wrinkles anymore. I asked the doctor to prescribe Renova to me.",renova,for treating wrinkles,neutral,396,402
276,"Extremely effective for staying awake. No jitters, just plain awake. Puts you in a great mood too, but definitely not high. ACNE. Horrible acne that starts deep in the skin and comes in clusters. I never had acne before this. I stopped this drug a few times, and the acne cleared up immediately. I have to find something to clear this up, or I will have to stop taking it for good. I started acne drugs listed above with no effect. This is terrible, Nuvigil works so good, but my skin looks dreadful. Clusters of gross looking acne, each is a big bump of different sizes. Works great, but acne is terrible",nuvigil,shift work sleep disorder,neutral,450,457
277,"I have taken this drug for four years, with a hiatus of about 1 year because I was afraid of dire side affects that had been widely advertised, having to do with the deterioration of jaw bone. The alendronate did not seem to stop the slow progression of my osteopenia, as measured by yearly bone density scans. I tried a regular exercise program, using a vibration machine (powerplate) and that stopped the progression of my osteopenia. I stopped the alendronate medication, thinking the exercise was more helpful and I was afraid of side effects. However, the exercise alone did not work. I have re-started the alendronate medication and am hoping that the combination of the medication and exercise will help. I have a bad taste in my mouth the day I take the alendronate medication and worry about side-affects, including long-term side affects which are undetectable currently. I take the medication 1/wk. I also run or walk daily.",alendronate,osteopenia,neutral,197,208
278,"no menopose benifits are loss off sytoms of menopose. improved mood leval. I have felt more energectic aand as stated a general mood elevation. I have started working out , less irratable and overall calmer. The hormone replacement has improved my lifestyle and relationships to others. I am know longer quick tempered or irritable. I have had some tirdeness and general sleep problems. I dont know if this was due to estrace or not. I have been someonewhat confused about hoe my energy has increased but my tirdness usually is in the morning when I take estrace. Perhaps I should try evening. i started 5 years ago due to hystromectery I hve a mood disorder and it was felt that menopose would complicate that. Since then I have thought it was the right decision and have been grateful foe the doctors suggestion.",estrace,replacement thearpy,neutral,418,425
279,"It did curb my desire to smoke. I went from smoking a pack a day after years of smoking to smoking one cigarette a day without using any nicotine substitutes. However, I never got to the point where I didn't have the one cigarette a day and the side effects were so severe that I had to stop taking the drug. The worst were the terrible nausea, gas and abdominal distress. I would be so nauseous after taking the drug that I would have to lie down for about forty five minutes before I could function. Also, as the treatment wore on, the gas pains became so painful that I just had to stop taking the drug. The gas pains grew more severe over time. I took the drug as prescribed but as noted above was not successful at quitting smoking.",chantix,smoking cessation,neutral,-1,-1
280,"none!!! i still feel very tired, no motivation, cant work, my body mind and feelings are numb, everything is still a struggle. ive tried talking to my gp about changing my meds but they say if i change i could get worse!! i started on 20mg pd then up to 40mg pd i feel the exact same as before i started taking them.",citalopram,anxiety/depreesion,negative,-1,-1
281,"nan Nausea, extreme sleepiness,severe headache, jittery, not myself,extremely grouchy, easily upset. Day one I felt negative side effects after taking the second dose. Day two, escalation of side effects, headache, sun sensitivity, foul mood. By day three I felt like a zombie and my head felt like it was going to explode. I could not bare noise, even my husbands voice and my own voice was too loud. I had slept a lot but never waking rested, just extremely sleepy and depressed. I called pharmacist on weekend and was told I was taking too much to start. She explained that with this medicine one needs to start low dose and work up. I reduced the dose but did not have a reduction of side effects. I went off before a week.",neurontin,all over and various type pain,negative,-1,-1
282,"My face and back acne cleared up within two weeks of regular use nausea, vaginal discomfort (dryness) the frustrating thing is that the acne will return shortly after you stop the treatment.",doxycycline,acne,positive,-1,-1
283,"none Nausea, loss of appetite, a little chest pain and vomiting. They gave me a shot of this at the hospital and then perscribed me with it. Once I got home I noticed I had an upset stomach, I thought it was because they gave me the shot on an empty stomach, so I ate something small and tried to take a nap. When I woke up from my nap my upset stomach did not go away and I felt naushes. I tried to drink a Powerade and eat a few preztles, that did not help at all. So for dinner I ate some soup and the upset stomach, nausea and chest pain still continued. I went to bed and woke up with stomach pains and still nausea. I ended up vomiting but only a little. I haven't taken any of the prescribed pills, just the shot at the hospital, and I am still feeling nausea, an upset stomach and a little chest pain. This medicine is not good at all. I couldn't lift anything heavy cause of the inflammation in my chest or breathe in really cold air. The doctor told me instead of using Naproxen I can take a hot shower, use a heating pad or to take Ibuprofen to alevate the pain I was feeling when the inflammation would come back or get worse.",naproxen,costochondritis/ inflammation of the chest wall,negative,980,988
284,"regulate sleep short psychotic episodes, sleep-walking. In an effort to regulate sleep, during an extended period of insomnia; patient was prescribed Ambien. The medication induced sleep as often as it induced short periods of psychotic behavior and patient was difficult to control by family. Patient would sleep-walk with no memory of it afterwards. Patient was beligerent with family members and appeared severly intoxicated.",ambien,insomnia,negative,150,156
285,"depression reduced - I had taken it at a lower dosage at first - but his had no effect - at all - so psychiatrist had to prescribe a higher dosage than the family doctors are allowed...the effect was amazing - I suddenly felt a 100% better after a week or so - I had been on the lower dosage for months with no effect. I felt nauseous. Gradually I became acclimatised the effects- so after the initial boost I felt normal again - like I could engage with life. After a while (6-months) I felt like I was experiencing a distance because of the drugs, instead of feeling engaged in life like I had felt initially, I felt like I was veiled from it. I was prescribed increasing doses by my family doctor until he had reached the maximum (150) he could prescribe. I tried to commit suicide, I was referred to a psychiatrist who doubled the dose. After seeing the psychiatrist twice over 2 months. I did not have to see her again. And my family doctor could continue to prescribe at this higher dose.",effexor,depression,neutral,-1,-1
286,"Overall mood was enhanced for a few months, then benefits plateaued and disappeared. Loss of sex drive; Increasing agitation; Heart palpitations making heart murmur much more apparent; Worsening nightmares and night sweats. Doctor hoped to wean me off of Xanax by using Effexor as what she called a ""non-addictive"" substitute. Unfortunately, I needed increasing doses of Xanax to counteract some of the side effects of the Effexor. Stopping Effexor resulted in about a week of zero energy and flu-like symptoms, and several weeks of mental confusion and what felt like ""brain zaps"".",effexor,depression/anxiety,positive,270,277
287,"mild facial improvement, healing was faster. Problem persisted. Problem increased upon ceasing of the medication. none once daily doryx, a time release version of doxycycline. It is a much more expensive version and when the insurance stopped paying for it the cost was prohibitive, like ten dollars per day. You could opt for the twice daily generic doxycycline, the manufacturer claims this is more effective.",doryx,acne,positive,130,135
288,"relieved pain at first but quickly became tolerant and wouls wear off hours before the next dose was due Severe constapation, moody, and became physicaly dependant Please becareful with this drug because it will produce horrible withdrawals and most Doctors will have no mercy for you and you will suffer greatly.",percocet,chronic back pain,positive,-1,-1
289,"After about a week, I started to see a small reduction in the size of the fluid-filled cysts behind my knees. Over the 3-week treatment period, there was about a 25 percent reduction in the size of the cysts. There was also a mild reduction in the pain associated with the cysts. Another benefit was that I did not get upper GI pain & bleeding with this med, whereas NSAIDs had been causing black stools due to GI irritation & bleeding. Within about 30 minutes of taking each dose of Sulindac, I experienced a colicky pain under my ribs on the right side. The pain was not extreme, but it was noticeable and unpleasant. Duration lasted 2 - 4 hours each time. This side effect persisted throughout the entire treatment period. Due to longstanding knee osteoarthritis, I am prone to fluid-filled cysts on the backside of my knees. The cysts cause pain, swelling, and reduced circulation to the lower leg. The cysts interfere with walking gait as well. In past I had used NSAIDs to reduce the inflammation of these cysts, however due to NSAID-related side effects, this class of drug was put off-limits by my physician. His recommendation was that I try a drug in the pro-NSAID class, which is less irritating to the stomach. In retrospect, I think that for me, the Sulindac was a trade-off: less stomach irritation exchanged for liver irritation with the Sulindac. Due to this side-effect, my doctor reduced frequency of medication to once per day. My response to the Sulindac was less robust than I had hoped for -- much less improvement than I had experienced previously with NSAIDs -- and it also took a long time (3 weeks) to reach the level of improvement that in past I would achieve in 3 days with OTC NSAIDs.",sulindac,baker's cysts behind both knees,positive,484,492
290,"It exfoliated my skin. My skin became extremely dry, irritated, red, and would peel. Use once daily, at night. Wash face, use toner and leave to dry (10 minutes). Then apply pea size amount of cream all over face, excluding eye area. Let soak in (15 minutes), then layer with moisturizer. Must wear sunscreen daily.",tazorac,acne,positive,-1,-1
291,"none body went into shock - rash all over my entire body, worst stomach I've experienced in my entire life. Had to be carried into the emergency room via ambulance until it cleared enough to return home. It's one day later and I still have the rash and am exhausted. Stay away. don't take it.",avelox,sinus infection,negative,-1,-1
292,Less pain with same symptoms Unclear thinking Condition was long term and stress related. Zoloft was merely a measure to ease the discomfort.,zoloft,irritable bowel syndrome,positive,90,96
293,I feel better about myself and less anxious and depressed. I have taken it for almost two weeks now and I feel really tired and increased yawning. I have taken it during the day and at night which in the morning I feel tired still. I take it once a day at 20mg per pill. I do better on it now then I do without it. So I will keep my fingers crossd and hope the sleepness goes away.,citalopram,depression,neutral,-1,-1
294,"Fingers didn't turn white for as long or as often as they used to. However, my fingers are still a shade of blue, and hands are still cold. My face still changes colors throughout the day, from pale, to blue, to red. It helped, but not enough. The doctor has prescribed 30mg Nifedipine to see if that works better. nan See above.",norvasc,raynaud's disease,positive,-1,-1
295,"Cleared active acne very effectively. Dry, cracked lips. Dark eye are due to thinning of skin. Extreme photosensitivity. Very dry, coarse skin. Four 20 mg capsules taken once daily. Also had to double reccommended daily water intake. Moisturised skin and lips when absolutell necessary although this was not advised by dermatologist due to clogging of pores.",sotret,acne,positive,-1,-1
296,"Is very helpful with insomnia. Was able to put racing thoughts that run threw my mind at rest. Was able to get into a deep sleep. Could still wake up in middle of the night and not be able to fall back asleep. I would sometimes fell groggy in the morning, especially at the begaining stage. It seems as if the effectivness starts to wear off with continued use. I take 1 pill everynight before bed as needed. Sometimes I could quit taking it when my sleep cycle was normal.",ambien,restless sleep,neutral,-1,-1
297,the treatment masked the psoriasis and what was considered arthritis increasing all over body pain I started with 4 tabs and increased to 6 as the all over body pain increased and then they were going to put me on prednisone. I opted to turn to homeopathic treatment and weaned off the methotrexate. The all over body pain went completely away but the psoriasis was exacerbated. I'd rather have that than not be able to walk or move.,methotrexate,psoraitic arthritis,neutral,286,298
298,"Clear appearance of skin, decreased pimples and cysts, it took one month for the medication to start working and had moderate effects was volatile to certain foods and dairy, skin very sensitive to sun, and dosent heal very well, if i stoppped taking the drug temporarary i would get combination of cystic acne and normal acne around neck and lower face and cheeks benzac, roaccutane, then MINOCYCLINE",minocycline,acne,positive,390,401
