id,text,aspect,category,polarity,from,to
143,"none stomach bloating,tired feeling,hallucination and no sound sleep I have been using modafinil since 5 days, 100mg for 3 days and 200 mg for 2 days along with citalopram 15(mg) as prescribed by my doc.Initially for 3 days (when I was on 100mg) it was ok,just slight irritability.But after taking 200mg felt the following-: 1.)Tired never before after 5hours 2.)Then began hallucination,felt like I am dreaming 3.) I became anxious,irritable and jittery feeling overcame me. 4.)Stomach bloating was so high that it bothered my heart a lot. 5.)Coudn't get a sound sleep. Not sure whether this happened because of modafinil alone or the mixing of citalopram and modafinil. But it sure did bother me.",provigil,anxiety and to avoid feeling misrable,positive,-1,-1
144,"I did not take the drug long enough to see any substantial beneficial effects I developed terrible weakness and pain in bilateral knees. I went from being extremely active to being unable to walk up a flight of stairs. It felt as though my knees would crumble under me.By the second week, I could barely walk up more than 3 steps. My doctor took me off the medication immediately, but the effects lasted about 6 months. My physician then tried a series of different medications for cholesterol. I was on Crestor, Simvastatin, and Zocor, all with the same side effect. My physician then ordered a lipid blood test to determine if the type of lipid found in my blood would promote cardiac disease, which thank goodness it didn't. I have a family history of elevated cholesterol: all the women in the family are on one of the cholesterol lowering medications: I am the only one in my family that experienced the above side effects.",lipitor,high cholesterol,negative,-1,-1
145,"Definitely lifted mood. Helped me feel full and able to turn down unhealthy snacks. Helped me eat reasonable portions. Occasional headache. Mild occasional insomnia Taken once a day it acts as a mood lifter and helps you feel full with less food. It helped me take off a few pounds. However, it is only a tool and patient has to be diligent about monitoring hunger and deciding to limit portions. It's easy to ""eat around"" the drug and overeat. For short term weight loss or to help lose 10 -15 lbs it is great. VERY expensive...$125 for one months supply.",meridia,weight loss,positive,-1,-1
146,"instantly i felt relieved. i am able to stand back a bit from things that would previously really upset me. i am therefore able not to let things get to me,fantastic. so now i don't explode instantly in anger at things anymore, i tried to think myself calm and non reactive previously but it did not work. with zoloft i have a calmness when meeting things that would normally make me enraged .i have time and mental space to be rational and realistic and can choose a sane quiet and dignified response, not aggression and anger. hallelujah. i felt very nauseous. and dizzy. but these subsided after one month. till then i made sure i ate something with taking the tablet to minimize the discomfort. it was a very very unpleasant sensation of nausea and a kind of vertigo, but the benefits outweighed the negatives. even though it was quite a strong feeling of sickness, very very strong. it has passed now though. thankfully. i considered stopping the zoloft because it was so bad, but if i went back to my old pattern of sadness and anxiety and arguing my husband may seriously have left me. so i persevered. glad i did too. cos the sickness has disapated. i take 50 mg tablet. one a day in the morning with food.",zoloft,"irritability,anxiety",neutral,311,317
147,"The treatment benefits of Vicodin (Hydrocodone and Acetaminophen) were relief of severe pain from surgical procedure. The side effects included: extreme dizziness, nausea, and disorientation. Also experienced cold sweats. Vicodin (Hydrocodone and Acetaminophen) was prescribed at one to two 500mg tablets every four to six hours. The drug induced deep sleep, followed by restlessness, heavy nausea, and extremem dizziness. Discontinued use of the drug after three days due to severity of side effects.",vicodin,post-op pain,negative,26,33
148,"By taking Yasmin I did not get pregnant, as it did act as a proper birth control method. However the side effects outweighed the benefits and I was forced to switch to a new form of birth control. I would NEVER recommend this type of birth control. Severe depression, mood swings, weight gain, longer period, yeast infections, and numerous other effects. 1 pill daily for 21 days and then a week break.",yasmin,birth control,negative,10,16
149,"None at all; my acne went from mild to severe. I woke up everyday with big new, painful whiteheads. Each time a group of pimples went away, several new ones formed immediately. I also have oily skin, and I read that Retin-A rapidly reduces oil; my skin is just as oily as the day I started and my acne is as bad as when I was a teenager. My skin has been extremely red the entire time I've taken this medication. It is so drying that even my ears and lips are persistently dry. I need to wear chap stick all day, everyday just to keep my lips from peeling. The area where I most use the cream has also been extremely dry and flaky. I applied it every night before bedtime.",retin-a-micro,acne,negative,-1,-1
150,none - the benefit was supposed to be due to the fact that it wasn't a steroid cream burning and itching worse than the eczema - I'd have to race to the shower and wash off remaining product - it was terrible apply twice daily but I'd have to wash it off w/in an hour because it burned so badly,protopic,eczema,negative,-1,-1
151,"I did see improvement in numbness and tinglng in upper extremities. Helps marginally for sleep. Poor concentration, drowsiness, dizziness, memory problems. My physian tried to titrate dose to 2400mg per day. The side effects were intolerable to the point that I was having prolems at work. I currently take 600mg hs. I plan to discontinue this medication as the side effects are not worth the marginal benefit",neurontin,chonic pain,positive,-1,-1
152,THE PILL WORKED VERY WELL WITH MY BODY. IT DIDN'T HAVE ANY SIDE EFFECTS ON ME LIKE SOME OTHER BIRTH CONTRACEPTION PILLS I DID NOT HAVE ANY NOTICEABLE SIDE EFFECTS TAKE THE PILL ONCE A DAY ABOUT THE SAME TIME FOR 28 DAYS AND THEN STOP TAKING IT FOR A WEEK TO START MY MENSTRUAL CYCLE.,alesse,prevent pregnancy,neutral,-1,-1
153,resistant sinus infection cleared up completely none I was prescribed this antibiotic after a course of a z-pak that didn't do the trick. This was a fast acting drug that was aggressive and effective and had little to no side effects. I will be requesting this as my first line of treatment from now on.,avelox,sinus infection,neutral,-1,-1
154,"Prevented pregnancy, completely cleared up my (moderate) acne. Taking Ortho TRI-Cyclen had a dramatic impact on my moods. I felt slow, distant, and complacent. I felt like a dumbed-down, watered-down version of myself. The physical effects were also disturbing: I developed a dark brown discharge and grew black hairs around my nipples. But the most extreme side effects actually occurred when I went OFF the pill, which I had to attempt twice before I could get through it: I experienced the most severe depression of my life, several week-long, heavy periods, hair loss, and very bad acne. Typical: 1 pill per day.",ortho-tri-cyclen,birth control,neutral,-1,-1
155,"after taking propecia for over a year, starting when i was 20 years of age my hair continued to thin, and i noticed no significant benefits Low sex drive, before i started taking this drug i was 19 years of age and full of ""enthousiasm"". Now engaged and 21 years old, my sex drive is very low, my wife and I are very unsatisfied. I am also very tired even during peak hours throughout the day, and its hard to concentrate on mundain tasks one pill once daily",propecia,hair loss,negative,13,21
156,"I was given this birth control to help stabilize my hormones to aid in clearing up my acne. I never saw a significant improvement in my acne. I suffered some very negative side effects. First, this medication made me nauseated. Secondly, and the effect that I am still trying to recover from, this medication gave me the ""pregnancy mask"" which is a darkening above the lip area. I was to take this birthcontrol pill daily to aid in the hormonal fluctuations that possibly were contributing to my acne.",ortho-tri-cyclen,acne,neutral,-1,-1
157,there were no benefits. This drug had more bad side effects than good ones. I will never try this again. there were no benefits. This drug had more bad side effects than good ones. I will never try this again. extreme weight gain and emotional distress. not sure. there were no benefits. This drug had more bad side effects than good ones. I will never try this again. there were no benefits.extreme weight gain and emotional distress.,premarin,menopause,negative,-1,-1
158,"My stomach aches went away. I wasn't as nauseated as I would have been without anything. I have been getting headaches sporadically and the doctor said this is a possbile side effect. Also, I was very nauseated the first 2 weeks, which they say happens in 30% of the population taking this drug, but then it subsided. I am taking this medication after being diagnosed with Irritable Bowel Syndrome. I was on Zelnorm for this and it was like a miracle drug!! It fixed all my problems for months, then it went off the market. The doctor then told me to try this as an option. It definately helps more than not taking anything at all and I can tell when I get these stomach pains that I forgot to take the drug.",amitiza,ibs,neutral,-1,-1
159,"my skin appeared smoother after an initial rough period with the start up of the product...fine lines seem to diminish and overall my skin seemed less sallow and more even toned....although, because of the continuing side effects it's difficult to stick with a consistent application very dry skin that would begin to peel and flake especially during the application of makeup...irritation producing some red spots near the sides of nostril and lips that prevented continued use of product for weeks...twice the application on the upper chest area produced a rash ... the sensivity to sun exposure increased even with strong sun screens thus inhibiting outside activity At first I applied a dime sized amount to my face every other day. I would wash my face and wait 10 minutes so the skin was completely dry for application. I applied the cream to the cheek area and spread outward trying to avoid the sensitive corners of the mouth, nose & eyes. I decreased the amount when I began to get some peeling and then took a break from treatment when I got obvious irritation. At this point, the treatment has to be on and off a schedule to avoid the side effects.",tazorac,anti aging,neutral,-1,-1
160,"THE NUVARING HAS PROVEN TO BE VERY EFFECTIVE FOR ME. I HAVE HAD A LOT OF PROBLEMS WITH BIRTH CONTROL THROUGHOUT MY LIFE. HAVING TRIED MANY IF NOT ALL POSSIBLE BIRTH CONTROL TREATMENTS, I BELIEVE THIS IS THE ONE THAT WORKS THE BEST FOR ME. IT IS PRACTICAL AND VERY FEW SIDE EFFECTS WHEN COMPARED TO THE ORAL CONTRACEPTIVES, IUDs OR INJECTIONS. SO FAR, I HAVE ONLY EXPERIENCED HEADACHES AROUND THE TIME WHEN I TAKE OUT MY RING. IT IS VERY EASY TO USE, YOU INSERT IT IN THE VAGINA, IT STAYS IN FOR 3 WEEKS AND TAKE IT OUT FOR ONE TO HAVE YOUR PERIOD. THEN PUT A NEW ONE IN. VERY EASY TO USE AND THE PARTNER DOES NOT FEEL DISCOMFORT DUE TO THE RING.",nuvaring,birth control,neutral,4,12
161,"The treatment benefits were smoking cessation, first a gradual reduction 2-10 a day then 1-2 a day then I quit for 2 weeks I experienced depression and severe anxiety. I had multiple strange dreams with physical sexual responses and my sleep patterns were disrupted frequently waking up in the middle of the night unable to go back to sleep, sexual dysfunction 2 a day",chantix,smoking cessation,negative,-1,-1
162,I'm not entirely sure it was effective at all. It was really difficult to quite taking Effexor. I had all kinds of panic attacks and severe depression when trying to quite. I must have tried to quite a dozen times. I think this is a dangerous drug. I took Effexor once daily at bedtime for 3 years.,effexor,depression,positive,87,94
163,"restful sleep carbohydrate cravings leading to overeating and overweight. I also tended to always needto increase the dose over the years. When I started using this drug, I was given a 50mg dose hs. I developed a tolerance and the dose needed to be increased until it reached 300mg. I was refered to a pharmacology specialist to see how I could be weaned off such a large dose in order to help control my weight because of the triggering of the carbohydrate cravings for which elavil is well known for. I have partiall been switched to topamax( 150mg hs with 225mg elavil hs) and I almost immediately lost 15lbs)",elavil,insomnia - early awakening,neutral,477,483
164,"Helped to fall asleep. No noticeable side effects, however, time release formula does not seem to work. Drug works for 4 or 5 hours then I wake up as usual in the middle of the night. I take this in an attempt to stay asleep like the drug promises. I rarely have trouble falling asleep. With Ambien CR, I fall asleep very quickly but still wake up most nights after 4 or 5 hours of sleeping. Therefore, the time release formula does not seem to work with me. In addition, this drug is unbelievably expensive. All in all, neither effective no priced within reason. I would not recommend.",ambien-cr,insomnia,neutral,-1,-1
165,"the treatment was to help lower my colesterol levels, i only took it for two weeks so i did not benefit from taken this treatment, muscle pain, loss of mobility, depresion, headaches i was admitted to hospital with chest pains, thought to be heart problems, it was caused by the tightening of my chest muscles. 1 to be taken daily, i only took this medication for two weeks after which i stopped taking it, the side effects that i had been suffering then stopped.",zocor,high colesterol,negative,-1,-1
166,"some clearing of acne but not completely. re-occurrence still happened. Scarring was still there. Overall, did not feel that effectiveness was best. Possibly a more natural cure would have been better. yellowing of teeth. some nausea. doctor warned of side effects and medication was still taken. taking tablets but also doing warm compresses on affected areas of skin. also went for extraction treatment. It is possible that the extractions were not done properly so that is why the scarring remained.",tetracycline,skin acne,positive,-1,-1
167,"My moods have improved dramatically. I would wake at least 3 times a night and have difficulty going back to sleep (sleep was always a problem), but now sleep is much better. Hot flashes were intense and distracting, and have since stopped. I originally took Premarin which gave me headaches. The patch and it's consistent delivery has helped immensely to reduce number and severity of headaches. The only drawback to using the patch is a mild allergy to the adhesive. Sometimes the patch slips and has come off several times in the bath, so I've had to pull out a new one. I do not like having to take progesterone separately in pill form, or at all, but with a uterus it is necessary. I'm also concerned about long-term effects. I originally began using HRT 5 years ago to help with very severe menopausal symptoms. I had tried all the natural remedies as I was very concerned about taking a medication: herbs, soy, etc. I walked 30 miles a week and did yoga, none of which helped. In desperation I visited my OB GYN who suggested I go on HRT, stating that quality of life needed to be considered. Shortly, thereafter, the reports initial study was released, and again I spoke to my doctor who said that she thought the results were over inflated. I switched to estradiol because it's considered more effective, and the patch bypasses the liver with delivery directly through the skin. I've since weaned myself off several times, only to have the symptoms return. I'm concerned about latest studies and have thought about weaning myself off again, and then think, ""quality of life"".",climara,hot flash sleep problems,neutral,-1,-1
168,Hair regrowth in crown area there were none One pill taken orally daily,propecia,hair loss,neutral,-1,-1
169,"None. The Cipro appeared not to work for my skin infection. Extreme swelling of the lips. I was approximately 44 years old. When fertilizing my garden, the wind kicked up and blew the fertilizer all over me. After washing it off, the skin on my midsection (around the stomach area) began to itch and turn red. Shortly afterwards, blisters appeared and the skin began to be infected. My doctor prescribed Cipro, which not only did not work but caused my lips to be extremely swollen, so swollen that the skin on my lips split in a few places and bled. I could actually easily see my swollen lips by simply casting my eyes downward. I stopped taking the Cipro and reported the condition to my doctor, who was at a loss to explain why the Cipro did not help my skin infection.",cipro,skin infection,negative,10,15
170,"I failed out of school three times before I started to take Adderall. University once and a local college twice, in two different programs. Went back and my grades went from D's and F's to B's. I was able to concentrate and retain information. I don't have the fatigue, I had and I want to get the day going, instead of laying in bed for as long as I could. Literally changed my life. Insomnia, dry mouth, appetite loss. 30mg slow release in the morning.",adderall,depression/add,neutral,60,68
171,"Alleviated pain in the affected area of the arm. Reduced all other symptoms also of Chronic Regional Pain Syndrome. Allowed me to get a good noghts sleep without waking and needing to shower due to excessive sweating which is symptomatic of the condition. Side effects were chronic constipation, for which I was prescribed Lactulose, headaches which would last for days, disturbed sleep patterns, vivid dreaming. The inability to concentrate for even moderate periods of time, dry mouth and sluggishness. The patches were prescribed following a consulatation with the local pain clinic and unsuccessful nerve blocks performed by both the pain clinic and the fracture consultant. After 6 months of side effects I decided to stop using the patches as I felt that the relief in pain was not matched by the quality of life provided by the use of the drug",fentanyl,chronic regional pain syndrome,neutral,-1,-1
172,"easing of arthritis symptoms, helped alleviate ""flu-like feeling"". SEVERE mouth ulcers all over the inside of my mouth and down my throat. Unable to eat or even drink for about one month. Became extremely dehydrated and went into acute renal failure. Gave myself a shot once a week. I think they quit making the injectible Methotrexate, which is a shame. It works SO MUCH BETTER than the pills.",methotrexate,psoriatic arthritis,neutral,323,335
173,medication allowed the patient to relax and helped reduced pain in legs. This resulted in reduction of Restless Legs Syndrome and also allowed the patient to have a good nights sleep. Minimal soreness in legs next morning. Slight groginess next morning. Take 5 mg valium between half hour and hour before retiring for the night. Only use when leag pain is going to disrupt sleep.,valium,muscle pain/spasms - legs,neutral,264,270
174,"Antibiotic seemed to work quickly. My throat felt better within hours of taking the first pill. Horrible, painful diarrhea after 4 hours of taking each pill I took on day one. Seems like a powerful antibiotic that works but it's just too powerful for my system and not worth the side effect.",zmax,strep throat,negative,-1,-1
175,"The bone mass in my spine improved. One hip was stable and one had lower bone density none I took the fosamax with 8 oz. of water and walked around for an hour.The first couple of years I did not take calcium supplements. Then I did. Since I do not think the results were really an improvemrnt, Now I am taking a calcium supplement with vitamin D and magnesium and a fairly new drug called foseum which is suppose to be entirely natural like an herb, but more expensive than fosamax that must be taken twice a day.",fosamax,osteopenia and osteoporosis,negative,102,109
176,"Clomiphene citrate or clomid is used for treatments of fertiliy in women. It triggers the ovaries to ripen more ovuls and to invrease the change of conceiving. bluuring vision, moodiness, depression, panic attacks, weight gain, skin problems Starting with the first day of menstruation as day 1, a daily dose of 150 mg is taken from day 5 to 9 of the monthly cycle. Chlomiphene citrate does first suppress estrogen in the womens body therefore the body reacts with an increased effort to build estrogen. After day 9 the increased effort to build estrogen comes effectiv in the ovaries producing more ovuls.",clomid,infertility,negative,22,28
177,"The benefits were not good, and this drug was very expensive and was not effective at all for the problem I was experiencing. At the time when I was experiencing complications from the implants, I truly believed that my Doctor did not prescribed the drug in time. The literature I read on this drug claims that it is more likely to work if used early in the treatment of Capsular Contracture. I tolerated the medication very well. I didn't experience any illness or side effects from Accolate. I felt a strong mental negativity towards the drug when it was prescribed based on the literature I read and my Doctor's statement about being treated early. I think I tried the treatment knowing in my mind that it was not going to work. I was required to take Accolate for three months to promote softening of my Breast Implants. The 20mg tablets were to be taken twice daily along with continued daily massage of my breasts. My Doctor said that the treatment had more chances of being effective if used early in detecting the Capsular Contracture (My treatment was started 5 months after the breast implant surgery). If the treatment didn't work, he advised, I would need surgery.",accolate,capsuar contracture of breast implant,negative,484,492
178,"No benefits, did not help the initial problem of the sinus infection severe diarrhea with blood/mucus caused by c difficile infection that led to colitis. Seven months later I have IBS now and still suffer from problems caused by the medication. stopped taking after 3 days because of the side effect",augmentin,sinus infection,negative,-1,-1
179,"helped with muscle spasms in my hips. Helped reduce pain from the spasms - particularly good when driving or sitting for a long time. some dry mouth, made me sleepy. When taking it on a daily basis for a number of months, I found that it was actually making me depressed, and causing other some cognitive recall problems, so I stopped taking it. As a medical doctor said, it's not a ""clean"" drug I was told to take it PRN - in other words on an ""as needed basis"" - which given that I have a type of hip dysplasia, was fairly often.",flexeril,muscle spasms,positive,-1,-1
180,"Patient experienced no treatment benefits. The major side effect was persistent thoughts of suicide - always by hanging. These thoughts developed after about three weeks of treatment and became more persistent as time went on. Patient stopped taking the medication after two months subsequently informing attending physician, who initially did not believe that medication could provoke that side effect in someone 50 years of age. Treatment details are as described above.",zoloft,depression,negative,-1,-1
181,Kept me knumb to deal with problems and issues Robotic demeanour Used daily....enjoyed nothing...felt very little.,paxil,depression,negative,-1,-1
182,nan Bad Taste but not as bad a most people say Took 2mg for the first time ever (first ever sleep med) on an empty stomach and went to bed at 9:30 Got up at 11:30 and am typing this. I feel alitte sleepy (yawns) but it obviously did zip aliviate onset insomnia.,lunesta,insomnia,negative,-1,-1
183,"No benefits whatsoever, no change in bone density. I took one tablet on the same day each week with plenty of water first thing in the morning and stood upright for the next two hours as I prepared for work. The side effects were numerous and severe, and with continued use compounded themselves to the point that I feared I may not survive the year. My physician at the time refused to believe me and insisted that I continue taking the drug. I began intense research on my own and discovered I was not alone, and would have to make every attempt to save myself. The side effects began with nausea and stomach pains mirroring acid reflux which even Nexium could not relieve. Then difficulty breathing and irregular heartbeat, extreme fatigue and body aches, finally vomiting matter resembling coffee grounds - really scary! After extensive research, I began a complete detoxification process accompanied by acupuncture which I believe ultimately saved my life. My advice: listen to what your body is telling you, be aware and be pro-active with your treatments.",fosamax,possible osteoporosis,negative,-1,-1
184,"Reduced stickiness of the blood.If inflammation of blood vessels did occur, the blood was thinner and so could get through vessels with reduced occurence of ulceration. General overall improval of condition. Minimal side effects, some nausea- very minimal. Inconvient to remember to take as they are required three or four times daily. Overall very pleased with results.",trental,behcet's disease,neutral,-1,-1
